release_date,title,speaker
2016-08-26,"The Federal Reserve's Monetary Policy Toolkit: Past, Present, and Future",Chair Janet L. Yellen
2016-09-12,"The ""New Normal"" and What It Means for Monetary Policy",Governor Lael Brainard
2016-09-26,Next Steps in the Evolution of Stress Testing,Governor Daniel K. Tarullo
2016-09-27,Why Study Economics?,Vice Chairman Stanley Fischer
2016-09-29,Trends in Community Bank Performance over the Past 20 Years,Governor Jerome H. Powell
2016-09-29,Brief Remarks,Chair Janet L. Yellen
2016-10-05,Low Interest Rates,Vice Chairman Stanley Fischer
2016-10-07,"Distributed Ledger Technology: Implications for Payments, Clearing, and Settlement",Governor Lael Brainard
2016-10-09,The U.S. Economy and Monetary Policy ,Vice Chairman Stanley Fischer
2016-10-14,Macroeconomic Research After the Crisis,Chair Janet L. Yellen
2016-10-17,Why Are Interest Rates So Low? Causes and Implications,Vice Chairman Stanley Fischer
2016-10-21,Pedagogy and Scholarship in a Post-Crisis World,Governor Daniel K. Tarullo
2016-10-24,Opening Remarks on Government Securities Settlement,Governor Jerome H. Powell
2016-11-04,The Economic Outlook,Vice Chairman Stanley Fischer
2016-11-11,U.S. Monetary Policy from an International Perspective,Vice Chairman Stanley Fischer
2016-11-15,Is There a Liquidity Problem Post-Crisis?,Vice Chairman Stanley Fischer
2016-11-17,"The ""Gig"" Economy: Implications of the Growth of Contingent Work",Governor Lael Brainard
2016-11-18,The Global Trade Slowdown and Its Implications for Emerging Asia,Governor Jerome H. Powell
2016-11-21,Longer-Term Challenges for the U.S. Economy,Vice Chairman Stanley Fischer
2016-11-29,Recent Economic Developments and Longer-Run Challenges,Governor Jerome H. Powell
2016-11-30,A View from the Fed,Governor Jerome H. Powell
2016-12-02,Financial Regulation Since the Crisis,Governor Daniel K. Tarullo
2016-12-02,The Opportunities and Challenges of Fintech,Governor Lael Brainard
2017-01-07,Low Interest Rates and the Financial System,Governor Jerome H. Powell
2017-01-12,Welcoming Remarks,Chair Janet L. Yellen
2017-01-17,Monetary Policy in a Time of Uncertainty,Governor Lael Brainard
2017-01-18,The Goals of Monetary Policy and How We Pursue Them,Chair Janet L. Yellen
2017-01-19,The Economic Outlook and the Conduct of Monetary Policy,Chair Janet L. Yellen
2017-02-11,"""I'd Rather Have Bob Solow Than an Econometric Model, But ...""",Vice Chairman Stanley Fischer
2017-02-22,The Economic Outlook and Monetary Policy,Governor Jerome H. Powell
2017-03-01,Transitions in the Outlook and Monetary Policy,Governor Lael Brainard
2017-03-03,From Adding Accommodation to Scaling It Back,Chair Janet L. Yellen
2017-03-03,"Innovation, Technology, and the Payments System",Governor Jerome H. Powell
2017-03-03,"Monetary Policy: By Rule, By Committee, or By Both?",Vice Chairman Stanley Fischer
2017-03-23,Welcoming Remarks,Chair Janet L. Yellen
2017-03-28,Addressing Workforce Development Challenges in Low-Income Communities,Chair Janet L. Yellen
2017-03-28,America's Central Bank: The History and Structure of the Federal Reserve,Governor Jerome H. Powell
2017-04-04,Departing Thoughts,Governor Daniel K. Tarullo
2017-04-05,Welcoming Remarks,Governor Jerome H. Powell
2017-04-17,Monetary Policy Expectations and Surprises,Vice Chairman Stanley Fischer
2017-04-19, International Effects of Recent Policy Tightening,Vice Chairman Stanley Fischer
2017-04-20,Brief Remarks,Governor Jerome H. Powell
2017-04-28,Where Do Banks Fit in the Fintech Stack?,Governor Lael Brainard
2017-05-05,Committee Decisions and Monetary Policy Rules,Vice Chairman Stanley Fischer
2017-05-05,So We All Can Succeed: 125 Years of Women's Participation in the Economy,Chair Janet L. Yellen
2017-05-22,Why Opportunity and Inclusion Matter to America’s Economic Strength,Governor Lael Brainard
2017-05-30,Navigating the Different Signals from Inflation and Unemployment,Governor Lael Brainard
2017-06-01,Thoughts on the Normalization of Monetary Policy,Governor Jerome H. Powell
2017-06-20,Housing and Financial Stability,Vice Chairman Stanley Fischer
2017-06-23,Central Clearing and Liquidity,Governor Jerome H. Powell
2017-06-26,Remarks,Governor Jerome H. Powell
2017-06-27,An Assessment of Financial Stability in the United States,Vice Chairman Stanley Fischer
2017-07-06,Government Policy and Labor Productivity,Vice Chairman Stanley Fischer
2017-07-06,The Case for Housing Finance Reform,Governor Jerome H. Powell
2017-07-11,Cross-Border Spillovers of Balance Sheet Normalization,Governor Lael Brainard
2017-07-13,Cross-Border Spillovers of Balance Sheet Normalization,Governor Lael Brainard
2017-07-28,Strengthening Diversity in Economics,Governor Lael Brainard
2017-07-31,The Low Level of Global Real Interest Rates,Vice Chairman Stanley Fischer
2017-08-25,Financial Stability a Decade after the Onset of the Crisis,Chair Janet L. Yellen
2017-08-30,The Role of Boards at Large Financial Firms,Governor Jerome H. Powell
2017-09-05,Understanding the Disconnect between Employment and Inflation with a Low Neutral Rate,Governor Lael Brainard
2017-09-26,Why Persistent Employment Disparities Matter for the Economy's Health,Governor Lael Brainard
2017-09-26,"Inflation, Uncertainty, and Monetary Policy",Chair Janet L. Yellen
2017-09-27,Labor Market Disparities and Economic Performance,Governor Lael Brainard
2017-09-28,The Independent Bank of England--20 Years On,Vice Chairman Stanley Fischer
2017-10-04,Welcoming Remarks,Chair Janet L. Yellen
2017-10-05,Treasury Markets and the TMPG,Governor Jerome H. Powell
2017-10-12,Rethinking Monetary Policy in a New Normal,Governor Lael Brainard
2017-10-12,Prospects for Emerging Market Economies in a Normalizing Global Economy,Governor Jerome H. Powell
2017-10-15,The U.S. Economy and Monetary Policy,Chair Janet L. Yellen
2017-10-18,Financial Innovation: A World in Transition,Governor Jerome H. Powell
2017-10-20,A Challenging Decade and a Question for the Future,Chair Janet L. Yellen
2017-11-02,Introductory Remarks,Governor Jerome H. Powell
2017-11-07,Remarks accepting the 2017 Paul H. Douglas Award for Ethics in Government,Chair Janet L. Yellen
2017-11-15,Regional Food Systems and Community Development,Governor Lael Brainard
2017-11-16,Where Do Consumers Fit in the Fintech Stack?,Governor Lael Brainard
2017-11-30,Thoughts on Prudent Innovation in the Payment System,Vice Chairman for Supervision Randal K. Quarles
2017-12-13,Workforce Development in Today's Economy,Governor Lael Brainard
2018-01-19,Early Observations on Improving the Effectiveness of Post-Crisis Regulation,Vice Chairman for Supervision Randal K. Quarles
2018-02-13,Remarks at the Ceremonial Swearing-in,Chairman Jerome H. Powell
2018-02-22,The U.S. Economy after the Global Financial Crisis,Vice Chairman for Supervision Randal K. Quarles
2018-02-26,An Assessment of the U.S. Economy,Vice Chairman for Supervision Randal K. Quarles
2018-02-26,Brief Thoughts on the Financial Regulatory System and Cybersecurity,Vice Chairman for Supervision Randal K. Quarles
2018-03-05,The Federal Reserve’s Regulatory Agenda for Foreign Banking Organizations: What Lies Ahead for Enhanced Prudential Standards and the Volcker Rule,Vice Chairman for Supervision Randal K. Quarles
2018-03-06,Navigating Monetary Policy as Headwinds Shift to Tailwinds,Governor Lael Brainard
2018-03-26,The Roles of Consumer Protection and Small Business Access to Credit in Financial Inclusion,Vice Chairman for Supervision Randal K. Quarles
2018-04-03,An Update on the Federal Reserve's Financial Stability Agenda,Governor Lael Brainard
2018-04-06,The Outlook for the U.S. Economy,Chairman Jerome H. Powell
2018-04-17,Community Development in Baltimore and A Few Observations on Community Reinvestment Act Modernization,Governor Lael Brainard
2018-04-19,Safeguarding Financial Resilience through the Cycle,Governor Lael Brainard
2018-05-04,Liquidity Regulation and the Size of the Fed's Balance Sheet,Vice Chairman for Supervision Randal K. Quarles
2018-05-08,Monetary Policy Influences on Global Financial Conditions and International Capital Flows,Chairman Jerome H. Powell
2018-05-15,"Cryptocurrencies, Digital Currencies, and Distributed Ledger Technologies: What Are We Learning?",Governor Lael Brainard
2018-05-16,Trust Everyone--But Brand Your Cattle: Finding the Right Balance in Cross-Border Resolution,Vice Chairman for Supervision Randal K. Quarles
2018-05-18,Keeping Community at the Heart of the Community Reinvestment Act,Governor Lael Brainard
2018-05-25,Financial Stability and Central Bank Transparency,Chairman Jerome H. Powell
2018-05-31,Sustaining Full Employment and Inflation around Target,Governor Lael Brainard
2018-06-20,Monetary Policy at a Time of Uncertainty and Tight Labor Markets,Chairman Jerome H. Powell
2018-06-27,America's Vital Interest in Global Efforts to Promote Financial Stability,Vice Chairman for Supervision Randal K. Quarles
2018-07-18,Getting It Right: Factors for Tailoring Supervision and Regulation of Large Financial Institutions,Vice Chairman for Supervision Randal K. Quarles
2018-07-19,Introductory Remarks,Vice Chairman for Supervision Randal K. Quarles
2018-08-24,Monetary Policy in a Changing Economy,Chairman Jerome H. Powell
2018-09-12,What Do We Mean by Neutral and What Role Does It Play in Monetary Policy?,Governor Lael Brainard
2018-09-27,Brief Remarks on the U.S. Economy,Chairman Jerome H. Powell
2018-10-02,Monetary Policy and Risk Management at a Time of Low Inflation and Low Unemployment,Chairman Jerome H. Powell
2018-10-03,Supporting Fast Payments for All,Governor Lael Brainard
2018-10-04,Trends in Urban and Rural Community Banks,Vice Chairman for Supervision Randal K. Quarles
2018-10-15,Community Investment in Denver,Governor Lael Brainard
2018-10-17,FinTech and the Search for Full Stack Financial Inclusion,Governor Lael Brainard
2018-10-18,Don’t Chase the Needles: An Optimistic Assessment of the Economic Outlook and Monetary Policy,Vice Chairman for Supervision Randal K. Quarles
2018-10-25,Outlook for the U.S. Economy and Monetary Policy,Vice Chairman Richard H. Clarida
2018-11-09,A New Chapter in Stress Testing,Vice Chairman for Supervision Randal K. Quarles
2018-11-13,What Are We Learning about Artificial Intelligence in Financial Services?,Governor Lael Brainard
2018-11-16,Beginning Stress Testing’s New Chapter,Vice Chairman for Supervision Randal K. Quarles
2018-11-27,Data Dependence and U.S. Monetary Policy,Vice Chairman Richard H. Clarida
2018-11-28,The Federal Reserve's Framework for Monitoring Financial Stability,Chairman Jerome H. Powell
2018-12-03,Celebrating Excellence in Community Development,Chairman Jerome H. Powell
2018-12-03,The Structure of the Treasury Market:  What Are We Learning?,Governor Lael Brainard
2018-12-03,Celebrating Excellence in Community Development,Governor Lael Brainard
2018-12-05,Banks as Vital Infrastructure for Rural Communities of the West,Vice Chairman for Supervision Randal K. Quarles
2018-12-06,Welcoming Remarks,Chairman Jerome H. Powell
2018-12-07,Assessing Financial Stability over the Cycle,Governor Lael Brainard
2019-01-09,Insurance Supervision and International Engagement,Vice Chairman for Supervision Randal K. Quarles
2019-01-10,Monetary Policy Outlook for 2019,Vice Chairman Richard H. Clarida
2019-02-01,Strengthening the Community Reinvestment Act: What Are We Learning?,Governor Lael Brainard
2019-02-06,Welcoming Remarks,Chairman Jerome H. Powell
2019-02-06,Inviting Participation: The Public's Role in Stress Testing's Next Chapter,Vice Chairman for Supervision Randal K. Quarles
2019-02-10,Ideas of Order: Charting a Course for the Financial Stability Board,Vice Chairman for Supervision and Chair of the Financial Stability Board Randal K. Quarles
2019-02-11,A Conversation on Community Banking,Governor Michelle W. Bowman
2019-02-12,Encouraging Economic Development in High-Poverty Rural Communities,Chairman Jerome H. Powell
2019-02-22,"The Federal Reserve's Review of Its Monetary Policy Strategy, Tools, and Communication Practices",Vice Chair Richard H. Clarida
2019-02-22,The Future of the Federal Reserve's Balance Sheet,Vice Chairman for Supervision Randal K. Quarles
2019-02-23,Is Economics for Me? Increasing the Participation of Black Women in Economics,Governor Lael Brainard
2019-02-28,Recent Economic Developments and Longer-Term Challenges,Chair Jerome H. Powell
2019-02-28,U.S. Economic Outlook and Monetary Policy,Vice Chair Richard H. Clarida
2019-03-07,Navigating Cautiously,Governor Lael Brainard
2019-03-08,Monetary Policy: Normalization and the Road Ahead,Chair Jerome H. Powell
2019-03-11,Brief Remarks,Chair Jerome H. Powell
2019-03-12,The Community Reinvestment Act: How Can We Preserve What Works and Make it Better?,Governor Lael Brainard
2019-03-25,Welcoming Remarks,Governor Michelle W. Bowman
2019-03-28,The Financial Stability Board in 2019,Vice Chair for Supervision and Chair of the Financial Stability Board Randal K. Quarles
2019-03-28,Global Shocks and the U.S. Economy,Vice Chair Richard H. Clarida
2019-03-28,Agriculture and Community Banking,Governor Michelle W. Bowman
2019-03-29,Frameworks for the Countercyclical Capital Buffer ,Vice Chair for Supervision Randal K. Quarles
2019-04-02,Fostering Closer Supervisory Communication,Governor Michelle W. Bowman
2019-04-02,The Financial Stability Board: Beyond the Fog of Battle,Vice Chair for Supervision and Chair of the Financial Stability Board Randal K. Quarles
2019-04-09,"The Federal Reserve's Review of Its Monetary Policy Strategy, Tools, and Communication Practices",Vice Chair Richard H. Clarida
2019-04-10,Progress on the Transition to Risk-Free Rates,Vice Chair for Supervision and Chair of the Financial Stability Board Randal K. Quarles
2019-04-11,U.S. Economic Outlook and Monetary Policy,Vice Chair Richard H. Clarida
2019-04-11,Community Banking in the Age of Innovation,Governor Michelle W. Bowman
2019-05-03,"Models, Markets, and Monetary Policy",Vice Chair Richard H. Clarida
2019-05-08,"""Fed Listens"" in Richmond: How Does Monetary Policy Affect Your Community?",Governor Lael Brainard
2019-05-09,Welcoming Remarks,Chair Jerome H. Powell
2019-05-10,Is the Middle Class within Reach for Middle-Income Families?,Governor Lael Brainard
2019-05-13,"The Federal Reserve’s Review of Its Monetary Policy Strategy, Tools, and Communication Practices",Vice Chair Richard H. Clarida
2019-05-16,The Disconnect between Inflation and Employment in the New Normal,Governor Lael Brainard
2019-05-17,"The Federal Reserve’s Review of Its Monetary Policy Strategy, Tools, and Communication Practices",Vice Chair Richard H. Clarida
2019-05-20,Business Debt and Our Dynamic Financial System,Chair Jerome H. Powell
2019-05-20,"The Federal Reserve's Review of Its Monetary Policy Strategy, Tools, and Communication Practices",Vice Chair Richard H. Clarida
2019-05-30,Sustaining Maximum Employment and Price Stability,Vice Chair Richard H. Clarida
2019-05-30,Monetary Policy and Financial Stability,Vice Chair for Supervision Randal K. Quarles
2019-06-03,The Next Stage in the LIBOR Transition (via prerecorded video),Vice Chair for Supervision Randal K. Quarles
2019-06-04,Opening Remarks,Chair Jerome H. Powell
2019-06-05,"The Federal Reserve's Review of Its Monetary Policy Strategy, Tools, and Communication Practices",Vice Chair Richard H. Clarida
2019-06-21,Fed Listens in Cincinnati: How Does Monetary Policy Affect Your Community?,Governor Lael Brainard
2019-06-25,Minority Depository Institutions,Governor Michelle W. Bowman
2019-06-25,Economic Outlook and Monetary Policy Review,Chair Jerome H. Powell
2019-07-01,"The Federal Reserve's Review of Its Monetary Policy Strategy, Tools, and Communication Practices",Vice Chair Richard H. Clarida
2019-07-09,Welcoming Remarks (via prerecorded video),Chair Jerome H. Powell
2019-07-09,Stress Testing: A Decade of Continuity and Change,Vice Chair for Supervision Randal K. Quarles
2019-07-11,Perspectives on the Economy from Scranton,Governor Lael Brainard
2019-07-16,Monetary Policy in the Post-Crisis Era,Chair Jerome H. Powell
2019-08-05,Delivering Fast Payments for All,Governor Lael Brainard
2019-08-20,A Decade of Building Stronger Communities,Vice Chair for Supervision Randal K. Quarles
2019-08-23,Challenges for Monetary Policy,Chair Jerome H. Powell
2019-09-04,Introductory Remarks,Governor Michelle W. Bowman
2019-09-05,Refining the Stress Capital Buffer,Vice Chair for Supervision Randal K. Quarles
2019-09-26,"The Federal Reserve’s Review of Its Monetary Policy Strategy, Tools, and Communication Practices",Vice Chair Richard H. Clarida
2019-09-26,Government of Union: Achieving Certainty in Cross-Border Finance,Vice Chair for Supervision and Chair of the Financial Stability Board Randal K. Quarles
2019-09-27,Law and Macroeconomics: The Global Evolution of Macroprudential Regulation,Vice Chair for Supervision Randal K. Quarles
2019-10-01,Advancing Our Understanding of Community Banking,Governor Michelle W. Bowman
2019-10-01,Introductory Remarks,Vice Chair Richard H. Clarida
2019-10-03,The Financial Stability Board at 10 Years—Looking Back and Looking Ahead,Vice Chair for Supervision and Chair of the Financial Stability Board Randal K. Quarles
2019-10-04,Opening Remarks,Chair Jerome H. Powell
2019-10-07,Brief Remarks,Chair Jerome H. Powell
2019-10-08,Data-Dependent Monetary Policy in an Evolving Economy,Chair Jerome H. Powell
2019-10-09,Opening Remarks,Chair Jerome H. Powell
2019-10-16,"Digital Currencies, Stablecoins, and the Evolving Payments Landscape",Governor Lael Brainard
2019-10-17,Opening Remarks ,Governor Michelle W. Bowman
2019-10-18,U.S. Economic Outlook and Monetary Policy,Vice Chair Richard H. Clarida
2019-10-21,Closing Remarks,Governor Michelle W. Bowman
2019-11-01,"The United States, Japan, and the Global Economy",Vice Chair Richard H. Clarida
2019-11-01,Friedrich Hayek and the Price System,Vice Chair for Supervision Randal K. Quarles
2019-11-08,Why Climate Change Matters for Monetary Policy and Financial Stability,Governor Lael Brainard
2019-11-12,"Monetary Policy, Price Stability, and Equilibrium Bond Yields: Success and Consequences",Vice Chair Richard H. Clarida
2019-11-14,Brief Remarks (via pre-recorded video),Vice Chair for Supervision Randal K. Quarles
2019-11-14,"The Federal Reserve’s Review of Its Monetary Policy Strategy, Tools, and Communication Practices",Vice Chair Richard H. Clarida
2019-11-25,Building on the Gains from the Long Expansion,Chair Jerome H. Powell
2019-11-26,"Federal Reserve Review of Monetary Policy Strategy, Tools, and Communications: Some Preliminary Views",Governor Lael Brainard
2019-12-18,"Update on Digital Currencies, Stablecoins, and the Challenges Ahead",Governor Lael Brainard
2020-01-08,Strengthening the Community Reinvestment Act by Staying True to Its Core Purpose,Governor Lael Brainard
2020-01-09,U.S. Economic Outlook and Monetary Policy,Vice Chair Richard H. Clarida
2020-01-16,The Outlook for Housing,Governor Michelle W. Bowman
2020-01-17,"Spontaneity and Order: Transparency, Accountability, and Fairness in Bank Supervision",Vice Chair for Supervision Randal K. Quarles
2020-02-05,The Digitalization of Payments and Currency: Some Issues for Consideration,Governor Lael Brainard
2020-02-06,"The Economic Outlook, Monetary Policy, and the Demand for Reserves",Vice Chair for Supervision Randal K. Quarles
2020-02-10,Empowering Community Banks,Governor Michelle W. Bowman
2020-02-11,"Spontaneity and Order:  Transparency, Accountability, and Fairness in Bank Supervision",Vice Chair for Supervision Randal K. Quarles
2020-02-21,Monetary Policy Strategies and Tools When Inflation and Interest Rates Are Low,Governor Lael Brainard
2020-02-21,Financial Markets and Monetary Policy: Is There a Hall of Mirrors Problem?,Vice Chair Richard H. Clarida
2020-02-25,U.S. Economic Outlook and Monetary Policy,Vice Chair Richard H. Clarida
2020-02-27,Direction of Supervision: Impact of Payment System Innovation on Community Banks,Governor Michelle W. Bowman
2020-04-09,COVID-19 and the Economy,Chair Jerome H. Powell
2020-05-05,Welcoming Remarks for Investment Connection – Response to COVID-19: Colorado,Governor Lael Brainard
2020-05-13,Current Economic Issues,Chair Jerome H. Powell
2020-05-21,U.S. Economic Outlook and Monetary Policy,Vice Chair Richard H. Clarida
2020-05-21,Opening Remarks,Chair Jerome H. Powell
2020-05-21,Introductory remarks for the Fed Listens panel on the COVID-19 pandemic,Governor Lael Brainard
2020-06-16,U.S. Economic Outlook and Monetary Policy (via prerecorded video),Vice Chair Richard H. Clarida
2020-06-19,The Adaptability of Stress Testing,Vice Chair for Supervision Randal K. Quarles
2020-06-19,Introductory Comments,Chair Jerome H. Powell
2020-07-07,Global in Life and Orderly in Death: Post-Crisis Reforms and the Too-Big-to-Fail Question,Vice Chair for Supervision and Chair of the Financial Stability Board Randal K. Quarles
2020-07-14,Navigating Monetary Policy through the Fog of COVID,Governor Lael Brainard
2020-08-06,The Future of Retail Payments in the United States,Governor Lael Brainard
2020-08-13,An Update on Digital Currencies,Governor Lael Brainard
2020-08-19,Brief Remarks ,Governor Michelle W. Bowman
2020-08-26,The Pandemic’s Effect on the Economy and Banking,Governor Michelle W. Bowman
2020-08-27,New Economic Challenges and the Fed's Monetary Policy Review,Chair Jerome H. Powell
2020-08-31,The Federal Reserve’s New Monetary Policy Framework: A Robust Evolution,Vice Chair Richard H. Clarida
2020-09-01,Bringing the Statement on Longer-Run Goals and Monetary Policy Strategy into Alignment with Longer-Run Changes in the Economy,Governor Lael Brainard
2020-09-21,Strengthening the CRA to Meet the Challenges of Our Time,Governor Lael Brainard
2020-09-23,Optimism in the Time of COVID,Vice Chair for Supervision Randal K. Quarles
2020-09-30,Community Banks Rise to the Challenge,Governor Michelle W. Bowman
2020-10-01,Modernizing and Strengthening CRA Regulations: Hearing from Community Banks,Governor Lael Brainard
2020-10-01,Mortgage Market Regulation and Access to Mortgage Credit,Governor Michelle W. Bowman
2020-10-06,Recent Economic Developments and the Challenges Ahead,Chair Jerome H. Powell
2020-10-14,U.S. Economic Outlook and Monetary Policy,Vice Chair Richard H. Clarida
2020-10-14,Remarks at the Hoover Institution,Vice Chair for Supervision Randal K. Quarles
2020-10-15,What Happened? What Have We Learned From It? Lessons from COVID-19 Stress on the Financial System,Vice Chair for Supervision Randal K. Quarles
2020-10-15,Modernizing and Strengthening CRA Regulations: A Conversation with Minority Depository Institutions,Governor Lael Brainard
2020-10-19,"U.S. Economic Outlook, Monetary Policy, and Initiatives to Sustain the Flow of Credit to Households and Firms ",Vice Chair Richard H. Clarida
2020-10-20,The Financial Stability Board’s Roadmap for Addressing NBFI Vulnerabilities,Vice Chair for Supervision Randal K. Quarles
2020-10-20,Modernizing and Strengthening CRA Regulations: A Conversation with the Housing Community,Governor Lael Brainard
2020-10-21,Achieving a Broad-Based and Inclusive Recovery,Governor Lael Brainard
2020-11-10,Modernizing and Strengthening CRA Regulations: A Conversation with the National Congress of American Indians,Governor Lael Brainard
2020-11-16,The Federal Reserve's New Framework: Context and Consequences,Vice Chair Richard H. Clarida
2020-11-17,Strengthening Diversity and Inclusion in Economics,Governor Lael Brainard
2020-11-19,The Changing Structure of Mortgage Markets and Financial Stability,Governor Michelle W. Bowman
2020-12-01,Modernizing and Strengthening CRA Regulations: A Conversation with the Chicago Community Trust,Governor Lael Brainard
2020-12-04,Technology and the Regulatory Agenda for Community Banking,Governor Michelle W. Bowman
2020-12-11,The Eye of Providence: Thoughts on the Evolution of Bank Supervision,Vice Chair for Supervision Randal K. Quarles
2020-12-17,Modernizing and Strengthening CRA Regulations: A Conversation with the  Consumer Bankers Association,Governor Lael Brainard
2020-12-18,Strengthening the Financial System to Meet the Challenge of Climate Change,Governor Lael Brainard
2021-01-08,U.S. Economic Outlook and Monetary Policy,Vice Chair Richard H. Clarida
2021-01-12,Supporting Responsible Use of AI and Equitable Outcomes in Financial Services,Governor Lael Brainard
2021-01-13, Full Employment in the New Monetary Policy Framework,Governor Lael Brainard
2021-01-13,The Federal Reserve's New Framework: Context and Consequences,Vice Chair Richard H. Clarida
2021-02-10,Getting Back to a Strong Labor Market,Chair Jerome H. Powell
2021-02-16,My Perspective on Bank Regulation and Supervision,Governor Michelle W. Bowman
2021-02-18,The Role of Financial Institutions in Tackling the Challenges of Climate Change,Governor Lael Brainard
2021-02-22,Economic Inclusion in Lower-Income Communities,Governor Michelle W. Bowman
2021-02-24,U.S. Economic Outlook and Monetary Policy,Vice Chair Richard H. Clarida
2021-02-24,How Should We Think about Full Employment in the Federal Reserve's Dual Mandate?,Governor Lael Brainard
2021-02-25,Themistocles and the Mathematicians: The Role of Stress Testing,Vice Chair for Supervision Randal K. Quarles
2021-03-01,Some Preliminary Financial Stability Lessons from the COVID-19 Shock ,Governor Lael Brainard
2021-03-02,U.S. Economic Outlook and Monetary Policy: An Update,Governor Lael Brainard
2021-03-18,Closing Remarks,Chair Jerome H. Powell
2021-03-22,Keynote Remarks,Vice Chair for Supervision Randal K. Quarles
2021-03-22,The Economic Outlook and Prospects for Small Business,Governor Michelle W. Bowman
2021-03-23,Financial Stability Implications of Climate Change,Governor Lael Brainard
2021-03-23,Remaining Patient as the Outlook Brightens,Governor Lael Brainard
2021-03-25,U.S. Economic Outlook and Monetary Policy,Vice Chair Richard H. Clarida
