release_date,title,speaker
1996-06-13,Bank supervision in a world economy,Chairman Alan Greenspan
1996-06-18,Developments in electronic money and banking,"Governor Edward W. Kelley, Jr."
1996-09-08,Monetary policy objectives and strategy,Governor Laurence H. Meyer
1996-09-19,Regulation and electronic payment systems,Chairman Alan Greenspan
1996-10-02,Small business is big business,Governor Lawrence B. Lindsey
1996-10-05,"Bank supervision, regulation, and risk",Chairman Alan Greenspan
1996-10-07,U.S. Treasury securities market: Lessons from Alexander Hamilton,Chairman Alan Greenspan
1996-10-09,Here we go again?,Governor Lawrence B. Lindsey
1996-10-11,How to grow faster,Governor Lawrence B. Lindsey
1996-10-16,Technological advances and productivity,Chairman Alan Greenspan
1996-10-24,Accounting and auditing standards and bank supervision,Governor Susan M. Phillips
1996-10-31,The future of electronic payments,"Governor Edward W. Kelley, Jr."
1996-11-18,Banking in the global marketplace,Chairman Alan Greenspan
1996-11-21,The transformation of the U.S. banking industry and resulting challenges to regulators,Governor Laurence H. Meyer
1996-11-25,Supervisory and regulatory responses to financial innovation and industry dynamics,Governor Susan M. Phillips
1996-12-03,Clearinghouses and risk management,"Governor Edward W. Kelley, Jr."
1996-12-05,The challenge of central banking in a democratic society,Chairman Alan Greenspan
1996-12-06,Social security,Chairman Alan Greenspan
1996-12-19,Supervision of bank risk-taking,Vice Chair Alice M. Rivlin
1997-01-05,The role of structural macroeconomic models,Governor Laurence H. Meyer
1997-01-14,Central banking and global finance,Chairman Alan Greenspan
1997-01-16,The economic outlook and challenges for monetary policy,Governor Laurence H. Meyer
1997-01-24,Financial modernization: Rationalizing the structure of the financial services industry,Governor Laurence H. Meyer
1997-01-28,International competition: Should we harmonize our national regulatory systems?,Governor Susan M. Phillips
1997-01-29,Are banks still special?,"Governor Edward W. Kelley, Jr."
1997-02-14,Risk management for banks and banking regulators in the 21st century,Governor Susan M. Phillips
1997-02-21,Government regulation and derivative contracts,Chairman Alan Greenspan
1997-03-03,Recent developments in supervision and regulation and how they affect the debate on financial modernization,Governor Susan M. Phillips
1997-03-07,Privacy in the information age,Chairman Alan Greenspan
1997-03-13,Sustaining CRA's success,Vice Chair Alice M. Rivlin
1997-03-22,Financial reform and the importance of a decentralized banking structure,Chairman Alan Greenspan
1997-04-04,The challenges of macroeconomic policy,Vice Chair Alice M. Rivlin
1997-04-10,Issues in financial modernization,Governor Laurence H. Meyer
1997-04-12,The evolution of banking in a market economy,Chairman Alan Greenspan
1997-04-24,The economic outlook and challenges facing monetary policy,Governor Laurence H. Meyer
1997-04-29,G-7 economic summit meeting,Chairman Alan Greenspan
1997-05-01,Technological change and the design of bank supervisory policies,Chairman Alan Greenspan
1997-05-03,Financial reform and importance of the state charter,Chairman Alan Greenspan
1997-05-08,Current monetary policy,Chairman Alan Greenspan
1997-05-23,The role of banks in small business finance,Governor Laurence H. Meyer
1997-06-10,The embrace of free markets,Chairman Alan Greenspan
1997-06-18,Models for neighborhood development and reinvestment,Governor Laurence H. Meyer
1997-06-18,The changing financial landscape and umbrella supervision,Governor Susan M. Phillips
1997-09-04,Affordable housing,Governor Laurence H. Meyer
1997-09-05,Rules vs. discretionary monetary policy,Chairman Alan Greenspan
1997-09-12,Monetary policy and the bond market: Complements or substitutes,Governor Laurence H. Meyer
1997-09-12,"Education, technology, and economic growth",Chairman Alan Greenspan
1997-09-17,The economic outlook and challenges facing monetary policy,Governor Laurence H. Meyer
1997-09-19,Derivatives and risk management,Governor Susan M. Phillips
1997-09-23,The role of the Federal Reserve in the payments system,"Governor Edward W. Kelley, Jr."
1997-10-05,Technological change and the economy,Chairman Alan Greenspan
1997-10-11,Consumer credit and financial modernization,Chairman Alan Greenspan
1997-10-14,Globalization of finance,Chairman Alan Greenspan
1997-10-14,Inaugural speech for economic seminar series,Chairman Alan Greenspan
1997-10-14,Globalization and U.S. monetary policy,Governor Laurence H. Meyer
1997-10-15,Black Monday: 10 years later,Governor Susan M. Phillips
1997-10-30,Trends and challenges in Federal Reserve bank supervision,Governor Susan M. Phillips
1997-10-31,Community development: Changes and challenges,Governor Laurence H. Meyer
1997-11-04,Risk management,Governor Susan M. Phillips
1997-11-07,Price measurement,Chairman Alan Greenspan
1997-12-01,New approaches to small business development partnerships,Governor Laurence H. Meyer
1997-12-02,Growth and flexibility: Lessons from Asia,Chairman Alan Greenspan
1997-12-03,The role of education during rapid economic change,Chairman Alan Greenspan
1997-12-15,"The ""Millennium Bug""","Governor Edward W. Kelley, Jr."
1998-01-03,Problems of price measurement,Chairman Alan Greenspan
1998-01-08,The economic outlook and challenges facing monetary policy,Governor Laurence H. Meyer
1998-01-12,Economic development in low- and moderate-income communities,Chairman Alan Greenspan
1998-01-16,The underemployment of minorities,Chairman Alan Greenspan
1998-02-11,Year 2000: a worldwide concern,"Governor Edward W. Kelley, Jr."
1998-02-17,Does good policy analysis matter?,Vice Chair Alice M. Rivlin
1998-02-26,The role of capital in optimal banking supervision and regulation,Chairman Alan Greenspan
1998-02-27,Risk management in the global financial system,Chairman Alan Greenspan
1998-02-27,Monetary rules,Governor Edward M. Gramlich
1998-03-02,Financial globalization and efficient banking regulation,Governor Laurence H. Meyer
1998-03-03,Implications of recent Asian developments for community banking,Chairman Alan Greenspan
1998-03-04,The Asian crisis: lessons to be learned and relearned,"Governor Roger W. Ferguson, Jr."
1998-03-06,Capital budgeting,Governor Edward M. Gramlich
1998-03-09,Bank supervision: lessons from the consulting perspective,"Governor Roger W. Ferguson, Jr."
1998-03-16,The strategy of monetary policy,Governor Laurence H. Meyer
1998-03-17,Four themes of sound international supervision,Governor Susan M. Phillips
1998-03-19,The changing banking environment and emerging questions for public policy,"Governor Roger W. Ferguson, Jr."
1998-03-19,Next steps for D.C.,Vice Chair Alice M. Rivlin
1998-03-26,Lessons and perspectives,Governor Susan M. Phillips
1998-04-02,Come with me to the FOMC,Governor Laurence H. Meyer
1998-04-02,The ascendance of market capitalism,Chairman Alan Greenspan
1998-04-04,The Federal Reserve's role in the payments system and its effect on competition,"Governor Roger W. Ferguson, Jr."
1998-04-09,The economic outlook and the challenges facing monetary policy,Governor Laurence H. Meyer
1998-04-16,The Federal Reserve and bank supervision and regulation,Governor Laurence H. Meyer
1998-04-16,Are banks safe for the world and is the world safe for banks?,"Governor Roger W. Ferguson, Jr."
1998-04-23,Toward a better class of financial crises: some lessons from Asia,Vice Chair Alice M. Rivlin
1998-04-30,Housing and the economy: sharing in the prosperity and broadening its base,Governor Laurence H. Meyer
1998-05-02,Our banking history,Chairman Alan Greenspan
1998-05-07,The U.S. retail payments system,Vice Chair Alice M. Rivlin
1998-05-07,Understanding today's international financial system,Chairman Alan Greenspan
1998-05-12,Commencement address,Vice Chair Alice M. Rivlin
1998-05-12,Community reinvestment in an era of bank consolidation and deregulation,Governor Laurence H. Meyer
1998-05-20,On the announcement of a new currency design,Chairman Alan Greenspan
1998-06-03,Economic forecasting,Governor Laurence H. Meyer
1998-06-09,Issues and trends in bank regulatory policy and financial modernization legislation,Governor Laurence H. Meyer
1998-06-18,Renewed confidence and vitality of the U.S. economy and the Asian crisis,Vice Chair Alice M. Rivlin
1998-07-09,Exercising caution and vigilance in monetary policy,"Governor Roger W. Ferguson, Jr."
1998-07-10,The implications of technological changes,Chairman Alan Greenspan
1998-07-20,Themes in international bank supervision,"Governor Roger W. Ferguson, Jr."
1998-08-28,Income inequality,Chairman Alan Greenspan
1998-09-04,Is there a new economy?,Chairman Alan Greenspan
1998-09-15,World capital flows,Governor Edward M. Gramlich
1998-09-17,The state of the U.S. economy,"Governor Roger W. Ferguson, Jr."
1998-09-18,Recent developments in banking and financial markets,Governor Laurence H. Meyer
1998-09-28,The Federal Reserve's roles in the payments system,Vice Chair Alice M. Rivlin
1998-09-29,Electronic banking,"Governor Roger W. Ferguson, Jr."
1998-10-05,The economic outlook and the challenges facing monetary policy,Governor Laurence H. Meyer
1998-10-14,The role for small businesses as viewed by a macroeconomic policymaker,"Governor Roger W. Ferguson, Jr."
1998-10-16,The challenge of preparing for the Year 2000,"Governor Roger W. Ferguson, Jr."
1998-10-22,Increasing global financial integrity,Governor Laurence H. Meyer
1998-10-22,The world economy,Vice Chair Alice M. Rivlin
1998-10-22,Three themes in search of an audience,"Governor Roger W. Ferguson, Jr."
1998-10-27,The future of the financial services sector and related public policy issues,"Governor Roger W. Ferguson, Jr."
1998-10-29,Countdown to Y2K: An economic assessment,"Governor Edward W. Kelley, Jr."
1998-11-05,The structure of the international financial system,Chairman Alan Greenspan
1998-11-06,Examining community reinvestment,Governor Edward M. Gramlich
1998-11-12,Modernizing financial services regulation,Governor Laurence H. Meyer
1999-01-03,Thoughts on the start of a new year,"Governor Roger W. Ferguson, Jr."
1999-01-04,The transformation of the U.S. banking system,Governor Laurence H. Meyer
1999-01-11,The transformation of the U.S. banking system,Governor Laurence H. Meyer
1999-01-15,The making of monetary policy,"Governor Roger W. Ferguson, Jr."
1999-01-21,The international millennium challenge,"Governor Roger W. Ferguson, Jr."
1999-02-11,Latin America: Lessons learned from the last twenty years,"Governor Roger W. Ferguson, Jr."
1999-02-16,The interaction of education and economic change,Chairman Alan Greenspan
1999-02-24,Dilemmas of an economic superpower,Vice Chair Alice M. Rivlin
1999-02-25,Evolution of financial institutions and markets: Private and policy implications,"Governor Roger W. Ferguson, Jr."
1999-02-25,The global economic outlook and monetary policy challenges,Governor Laurence H. Meyer
1999-03-01,Learning from financial market turbulence,Vice Chair Alice M. Rivlin
1999-03-03,Global financial integration,"Governor Roger W. Ferguson, Jr."
1999-03-08,Small business access to capital and credit,Governor Edward M. Gramlich
1999-03-08,Mortgage finance,Chairman Alan Greenspan
1999-03-09,Changes in small business finance,Chairman Alan Greenspan
1999-03-10,Y2K and public confidence in the banking system,"Governor Edward W. Kelley, Jr."
1999-03-12,Financial modernization: The issues,Governor Laurence H. Meyer
1999-03-16,The farm economy,Chairman Alan Greenspan
1999-03-16,Small business access to capital: Current status and initiatives,"Governor Roger W. Ferguson, Jr."
1999-03-19,Financial derivatives,Chairman Alan Greenspan
1999-03-25,Thinking about Y2K,"Governor Edward W. Kelley, Jr."
1999-04-06,Social Security,Vice Chair Alice M. Rivlin
1999-04-13,The payments system and Year 2000,"Governor Roger W. Ferguson, Jr."
1999-04-14,The global economic outlook and monetary policy challenges,Governor Laurence H. Meyer
1999-04-16,Technology and trade,Chairman Alan Greenspan
1999-04-22,"Structure, instability, and the world economy",Governor Laurence H. Meyer
1999-04-22,A stabilization policy strategy,Governor Edward M. Gramlich
1999-04-26,The euro in the international financial system,Governor Laurence H. Meyer
1999-04-29,Currency reserves and debt,Chairman Alan Greenspan
1999-05-06,The American economy in a world context,Chairman Alan Greenspan
1999-05-13,On economic literacy,Vice Chair Alice M. Rivlin
1999-05-13,On sustaining U.S. economic growth,Vice Chair Alice M. Rivlin
1999-06-01,Dilemmas facing United States policymakers,Vice Chair Alice M. Rivlin
1999-06-02,Trade and technology,Chairman Alan Greenspan
1999-06-03,Moving forward into the 21st century,Governor Laurence H. Meyer
1999-06-10,Commencement address,Chairman Alan Greenspan
1999-06-10,The making of monetary policy,"Governor Roger W. Ferguson, Jr."
1999-06-14,Market discipline as a complement to bank supervision and regulation,Governor Laurence H. Meyer
1999-06-16,A policy in Lampman's tradition: The Community Reinvestment Act,Governor Edward M. Gramlich
1999-06-22,Public information and public confidence in year 2000,"Governor Roger W. Ferguson, Jr."
1999-07-29,Continuing the countdown to year 2000: Focusing on public disclosure and public confidence,"Governor Roger W. Ferguson, Jr."
1999-08-27,New challenges for monetary policy,Chairman Alan Greenspan
1999-09-08,Maintaining economic vitality,Chairman Alan Greenspan
1999-09-08,Q&A on the economic outlook and the challenges facing monetary policy,Governor Laurence H. Meyer
1999-09-09,Transparency and responsibility in monetary policy,"Governor Roger W. Ferguson, Jr."
1999-09-15,Small businesses in the U.S. economy,Governor Edward M. Gramlich
1999-09-16,Readiness of financial institutions for the year 2000,"Governor Edward W. Kelley, Jr."
1999-09-17,Status of Y2K preparedness,Chairman Alan Greenspan
1999-09-17,Electronic money in the United States,Governor Edward M. Gramlich
1999-09-21,Is information technology the key to higher productivity growth in the United States and abroad?,"Governor Roger W. Ferguson, Jr."
1999-09-27,An agenda for bank supervision and regulation,Governor Laurence H. Meyer
1999-09-27,Lessons from the global crises,Chairman Alan Greenspan
1999-09-28,Year 2000: Ninety-four days and counting,"Governor Roger W. Ferguson, Jr."
1999-09-30,Trade and technology,Chairman Alan Greenspan
1999-10-01,Implications of recent global financial crises for bank supervision and regulation,Governor Laurence H. Meyer
1999-10-06,Year 2000: Eighty-six days and counting,"Vice Chairman Roger W. Ferguson, Jr."
1999-10-11,The evolution of bank supervision,Chairman Alan Greenspan
1999-10-12,New challenges for monetary policy: The view from Jackson Hole,Governor Laurence H. Meyer
1999-10-14,Measuring financial risk in the twenty-first century,Chairman Alan Greenspan
1999-10-15,"Business, the economy, and the new millenium",Chairman Alan Greenspan
1999-10-19,Do efficient financial markets mitigate financial crises?,Chairman Alan Greenspan
1999-10-28,Financial market lessons for bankers and bank supervisors,"Vice Chairman Roger W. Ferguson, Jr."
1999-10-28,"Information, productivity, and capital investment",Chairman Alan Greenspan
1999-11-02,Mortgage markets and economic activity,Chairman Alan Greenspan
1999-11-04,Consumer credit in the 21st century,Governor Edward M. Gramlich
1999-11-15,Insurance companies and banks under the new regulatory law,Chairman Alan Greenspan
1999-11-30,"Start with a paradigm, end with a story: The value of model-based forecasting and policy analysis",Governor Laurence H. Meyer
1999-12-15,The implications of financial modernization legislation for bank supervision,Governor Laurence H. Meyer
2000-01-07,Tale of two continents: A comparison of Asian and Latin American experiences during recent financial turmoil,"Vice Chairman Roger W. Ferguson, Jr."
2000-01-13,Inflation targeting,Governor Edward M. Gramlich
2000-01-13,Technology and the economy,Chairman Alan Greenspan
2000-01-14,Supervising LCBOs: Adapting to change,Governor Laurence H. Meyer
2000-01-20,Sustainability and monetary policy,Governor Laurence H. Meyer
2000-02-03,Implementing the Gramm-Leach-Bliley Act,Governor Laurence H. Meyer
2000-02-17,The new economy: Unanswered questions for 2000,"Vice Chairman Roger W. Ferguson, Jr."
2000-02-23,How does a surplus affect the formulation and conduct of monetary policy?,Governor Laurence H. Meyer
2000-02-25,Strengthening risk management for derivatives,Governor Laurence H. Meyer
2000-03-03,Structural change and monetary policy,Governor Laurence H. Meyer
2000-03-06,The revolution in information technology,Chairman Alan Greenspan
2000-03-06,Convergence of regulatory standards: A work in process,"Vice Chairman Roger W. Ferguson, Jr."
2000-03-07,CRA and financial modernization,Governor Edward M. Gramlich
2000-03-08,Challenges facing community banks,Chairman Alan Greenspan
2000-03-13,Social security in the 21st century,Governor Edward M. Gramlich
2000-03-22,Economic challenges in the new century,Chairman Alan Greenspan
2000-03-30,Learning from experience: Y2K revisited,"Governor Edward W. Kelley, Jr."
2000-04-05,Technological innovation and the economy,Chairman Alan Greenspan
2000-04-06,Realism during times of opportunity,"Vice Chairman Roger W. Ferguson, Jr."
2000-04-07,Technology innovation and its economic impact,Chairman Alan Greenspan
2000-04-10,Retail payment systems,Chairman Alan Greenspan
2000-04-11,The evolving demand for skills,Chairman Alan Greenspan
2000-04-12,The economic outlook and the challenges facing monetary policy,Governor Laurence H. Meyer
2000-04-14,Technology and financial services,Chairman Alan Greenspan
2000-04-14,Predatory lending,Governor Edward M. Gramlich
2000-04-17,The digital divide,Governor Edward M. Gramlich
2000-04-20,Investment and saving,Governor Edward M. Gramlich
2000-04-27,The economy of rural America,Chairman Alan Greenspan
2000-05-04,Banking evolution,Chairman Alan Greenspan
2000-05-04,"Electronic commerce, banking, and payments","Vice Chairman Roger W. Ferguson, Jr."
2000-05-09,"Conversation with leaders of the ""New Economy""","Vice Chairman Roger W. Ferguson, Jr."
2000-05-11,The Ohio economy,"Vice Chairman Roger W. Ferguson, Jr."
2000-05-12,Economic policy for our era: The Florida experience,"Vice Chairman Roger W. Ferguson, Jr."
2000-05-18,Permanent normal trade relations with China,Chairman Alan Greenspan
2000-05-22,"Community banks: Opportunities and challenges in the ""post modernization era""","Vice Chairman Roger W. Ferguson, Jr."
2000-05-25,Evolving challenges for bankers and supervisors,Chairman Alan Greenspan
2000-05-26,Umbrella supervision: Emerging approaches,"Vice Chairman Roger W. Ferguson, Jr."
2000-05-31,The challenges of global financial institution supervision,Governor Laurence H. Meyer
2000-06-01,"The roles of banks, supervisors, and the market in advancing risk management",Governor Laurence H. Meyer
2000-06-06,The new economy meets supply and demand,Governor Laurence H. Meyer
2000-06-13,Business data analysis,Chairman Alan Greenspan
2000-07-11,Structural change in the new economy,Chairman Alan Greenspan
2000-07-12,Global challenges,Chairman Alan Greenspan
2000-08-25,Global economic integration: Opportunities and challenges,Chairman Alan Greenspan
2000-08-31,Why risk management is important for global financial institutions,Governor Laurence H. Meyer
2000-09-15,Some recent findings regarding the economic condition of minority Americans,"Vice Chairman Roger W. Ferguson, Jr."
2000-09-18,Banking supervision,Chairman Alan Greenspan
2000-10-11,Perspectives on innovation in the retail payments system,"Vice Chairman Roger W. Ferguson, Jr."
2000-10-16,Electronic finance,Chairman Alan Greenspan
2000-10-19,The economic outlook and the challenges facing monetary policy,Governor Laurence H. Meyer
2000-10-19,Challenges for monetary policymakers,Chairman Alan Greenspan
2000-10-19,Financial education: The next chapter in community development,"Vice Chairman Roger W. Ferguson, Jr."
2000-10-20,Information technology in banking and supervision,"Vice Chairman Roger W. Ferguson, Jr."
2000-10-24,The politics of monetary policy: Balancing independence and accountability,Governor Laurence H. Meyer
2000-10-31,Opportunities and challenges in community banking,"Vice Chairman Roger W. Ferguson, Jr."
2000-11-14,Globalization,Chairman Alan Greenspan
2000-11-20,Technology and banking,Chairman Alan Greenspan
2000-11-21,Financial literacy,Governor Edward M. Gramlich
2000-12-05,Structural changes in the economy and financial markets,Chairman Alan Greenspan
2000-12-06,"Subprime lending, predatory lending",Governor Edward M. Gramlich
2000-12-06,"Technology, macroeconomics, and monetary policy","Vice Chairman Roger W. Ferguson, Jr."
2000-12-08,Productivity and efficiency in the Federal Reserve System,Chairman Alan Greenspan
2001-01-12,"Domestic macroeconomic developments: Past, present, and future","Vice Chairman Roger W. Ferguson, Jr."
2001-01-25,G-10 study of financial sector consolidation,"Vice Chairman Roger W. Ferguson, Jr."
2001-02-14,E-commerce: Lessons learned to date,"Vice Chairman Roger W. Ferguson, Jr."
2001-02-15,Implementing the Gramm-Leach-Bliley Act: One year later,Governor Laurence H. Meyer
2001-02-20,The productivity growth spurt in the United States,Governor Edward M. Gramlich
2001-02-27,Understanding financial consolidation,"Vice Chairman Roger W. Ferguson, Jr."
2001-03-05,The new Basel capital proposal,Governor Laurence H. Meyer
2001-03-07,Banking supervision,Chairman Alan Greenspan
2001-03-09,Understanding financial consolidation,"Vice Chairman Roger W. Ferguson, Jr."
2001-03-15,Capital standards and community banks,Governor Laurence H. Meyer
2001-03-23,Tackling predatory lending: Regulation and education,Governor Edward M. Gramlich
2001-03-27,The challenge of measuring and modeling a dynamic economy,Chairman Alan Greenspan
2001-03-28,Does money matter?,Governor Laurence H. Meyer
2001-04-05,Understanding financial consolidation,"Vice Chairman Roger W. Ferguson, Jr."
2001-04-05,Research in the policy process,Governor Edward M. Gramlich
2001-04-06,The importance of education in todays economy,Chairman Alan Greenspan
2001-04-19,Transparency in central banking: Rationale and recent developments,"Vice Chairman Roger W. Ferguson, Jr."
2001-04-19,Social security reform in the twenty-first century,Governor Edward M. Gramlich
2001-04-26,Understanding financial consolidation,"Vice Chairman Roger W. Ferguson, Jr."
2001-04-27,The paydown of federal debt,Chairman Alan Greenspan
2001-05-10,The financial safety net,Chairman Alan Greenspan
2001-05-10,Controlling the safety net,Governor Laurence H. Meyer
2001-05-17,The new Basel accord: Challenges for banks and their supervisors,Governor Laurence H. Meyer
2001-05-18,Issues for bank regulators,Chairman Alan Greenspan
2001-05-21,A few thoughts on financial sector and payments activities,"Vice Chairman Roger W. Ferguson, Jr."
2001-05-21,Comparative central banking and the politics of monetary policy,Governor Laurence H. Meyer
2001-05-24,Global outlook and challenges facing central banks around the world,Governor Laurence H. Meyer
2001-05-24,Economic developments,Chairman Alan Greenspan
2001-06-06,What happened to the new economy?,Governor Laurence H. Meyer
2001-06-11,National saving and Treasury debt,Governor Edward M. Gramlich
2001-06-14,"The productivity experience of the United States: Past, present, and future","Vice Chairman Roger W. Ferguson, Jr."
2001-06-20,Saving by low- and moderate-income households,Governor Edward M. Gramlich
2001-06-20,The growing need for skills in the 21st century,Chairman Alan Greenspan
2001-06-28,The value of public outreach by the Federal Reserve,Chairman Alan Greenspan
2001-06-28,Impact of energy on the economy,Chairman Alan Greenspan
2001-07-17,Inflation targets and inflation targeting,Governor Laurence H. Meyer
2001-07-18,Reflections on the capital goods overhang,"Vice Chairman Roger W. Ferguson, Jr."
2001-08-03,Infrastructure and economic development,Governor Edward M. Gramlich
2001-08-31,"Technology, information production, and market efficiency","Vice Chairman Roger W. Ferguson, Jr."
2001-08-31,Opening remarks,Chairman Alan Greenspan
2001-09-04,The evolving financial and payment system,"Vice Chairman Roger W. Ferguson, Jr."
2001-10-11,Transparency in monetary policy,Chairman Alan Greenspan
2001-10-12,Executing monetary policy without Treasuries,Governor Laurence H. Meyer
2001-10-15,Basel II: Moving from concept toward implementation,Governor Laurence H. Meyer
2001-10-16,Credit risk management: Models and judgment,"Vice Chairman Roger W. Ferguson, Jr."
2001-10-23,The September 11 tragedy and the response of the financial industry,Chairman Alan Greenspan
2001-10-23,Preparing for CRA 2002,Governor Edward M. Gramlich
2001-10-24,Globalization,Chairman Alan Greenspan
2001-10-26,The importance of financial education and literacy,Chairman Alan Greenspan
2001-11-08,Promoting and sustaining home ownership,Governor Edward M. Gramlich
2001-11-08,Certified public accountants: Partners in financial stability,"Vice Chairman Roger W. Ferguson, Jr."
2001-11-13,Energy supply,Chairman Alan Greenspan
2001-11-27,Before and after,Governor Laurence H. Meyer
2001-11-30,Asset prices and monetary policy,Governor Edward M. Gramlich
2001-11-30,The euro as an international currency,Chairman Alan Greenspan
2001-12-03,Globalization,Chairman Alan Greenspan
2001-12-05,The future of money and of monetary policy,Governor Laurence H. Meyer
2001-12-18,Financial stability in emerging markets: What have we accomplished and what remains to be done?,Governor Laurence H. Meyer
2002-01-08,Why central banks should talk,"Vice Chairman Roger W. Ferguson, Jr."
2002-01-10,Economic development and financial literacy,Chairman Alan Greenspan
2002-01-11,The economy,Chairman Alan Greenspan
