release_date,title,speaker
2005-11-03,"Monetary Credibility, Inflation, and Economic Growth","Vice Chairman Roger W. Ferguson, Jr."
2005-11-07,A Look at Fair Lending through the Lens of the New HMDA Data,Governor Mark W. Olson
2005-11-14,Stability and Economic Growth: The Role of the Central Bank,Chairman Alan Greenspan
2005-11-15,Asset Price Levels and Volatility: Causes and Implications,"Vice Chairman Roger W. Ferguson, Jr."
2005-11-15,Perspectives on the Development of a Unified National Payments System in the United States,Governor Mark W. Olson
2005-11-28,Financial Regulation: Seeking the Middle Way,"Vice Chairman Roger W. Ferguson, Jr."
2005-11-29,Recent Changes in Household Finances and Home Lending,"Vice Chairman Roger W. Ferguson, Jr."
2005-11-30,Recent Developments in Regulatory Capital,Governor Susan Schmidt Bies
2005-12-02,Budget policy,Chairman Alan Greenspan
2005-12-02,International imbalances,Chairman Alan Greenspan
2005-12-05,Economic Growth: Lessons from the Sioux Falls Experience,Governor Mark W. Olson
2005-12-06,Linkages between Internal Capital Measures and Regulatory Capital Requirements,Governor Susan Schmidt Bies
2005-12-14,Remarks on receipt of honorary degree,Chairman Alan Greenspan
2006-01-18,Productivity and Economic Outlook,Governor Susan Schmidt Bies
2006-02-02,The Continuous Challenges of Risk Management,Governor Susan Schmidt Bies
2006-02-06,Remarks at ceremonial swearing-in by President Bush,Chairman Ben S. Bernanke
2006-02-23,"Globalization, Insurers, and Regulators: Shared Challenges Call for Collaborative Solutions","Vice Chairman Roger W. Ferguson, Jr."
2006-02-24,The Benefits of Price Stability,Chairman Ben S. Bernanke
2006-02-24,The Importance of Education,"Vice Chairman Roger W. Ferguson, Jr."
2006-03-03,Economic Outlook for the United States,"Vice Chairman Roger W. Ferguson, Jr."
2006-03-08,Community Banking and Community Bank Supervision ,Chairman Ben S. Bernanke
2006-03-10,Remarks,"Vice Chairman Roger W. Ferguson, Jr."
2006-03-13,Are Banks Still Special?,Governor Mark W. Olson
2006-03-16,Monetary policy and asset prices,Governor Donald L. Kohn
2006-03-20,Reflections on the Yield Curve and Monetary Policy,Chairman Ben S. Bernanke
2006-03-29,Sound Capital and Risk Management,Governor Susan Schmidt Bies
2006-03-31,An Update on Regulatory Issues,Governor Susan Schmidt Bies
2006-03-31,Financial Regulation: Seeking the Middle Way,"Vice Chairman Roger W. Ferguson, Jr."
2006-04-03,"Central Counterparty Clearing: History, Innovation, and Regulation",Governor Randall S. Kroszner
2006-04-05,Financial Education and the National Jump$tart Coalition Survey,Chairman Ben S. Bernanke
2006-04-06,The Effect of Removing Geographic Restrictions on Banking in the United States: Lessons for Europe,Governor Randall S. Kroszner
2006-04-10,A Risk-Management Perspective on Recent Regulatory Proposals,Governor Susan Schmidt Bies
2006-04-10,Enterprise-Wide Compliance-Risk Management,Governor Mark W. Olson
2006-04-13,Update on the U.S. economy,Governor Mark W. Olson
2006-04-13,Economic outlook,Governor Donald L. Kohn
2006-04-17,Thoughts on Financial Stability and Central Banking,"Vice Chairman Roger W. Ferguson, Jr."
2006-04-20,By the Numbers: Data and Measurement in Community Economic Development,Chairman Ben S. Bernanke
2006-04-27,Business Capital Spending,Governor Donald L. Kohn
2006-04-28,A Bank Supervisor's Perspective on Enterprise Risk Management,Governor Susan Schmidt Bies
2006-05-03,Community Revitalization: Lessons from Anacostia,Chairman Ben S. Bernanke
2006-05-04,"Supervisory Perspective on Current Bank Capital, Market Risk, and Loan Product Issues",Governor Susan Schmidt Bies
2006-05-11,Investing in Payment Innovations:  A Federal Reserve Perspective,Governor Donald L. Kohn
2006-05-16,Hedge Funds and Systemic Risk,Chairman Ben S. Bernanke
2006-05-16,Compliance Risk Management in a Diversified Environment,Governor Mark W. Olson
2006-05-16,Implementing Basel II: Choices and Challenges,Governor Susan Schmidt Bies
2006-05-18,The Evolving Nature of the Financial System: Financial Crises and the Role of the Central Bank,Governor Donald L. Kohn
2006-05-18,Basel II: Its Promise and Its Challenges,Chairman Ben S. Bernanke
2006-05-24,Innovative Statistics for a Dynamic Economy,Governor Randall S. Kroszner
2006-05-25,Community Development and the Bigger Picture,Governor Mark W. Olson
2006-06-05,Panel Discussion: Comments on the Outlook for the U.S. Economy and Monetary Policy,Chairman Ben S. Bernanke
2006-06-06,Challenges of Conducting Effective Risk Management in Community Banks,Governor Susan Schmidt Bies
2006-06-09,Commencement address,Chairman Ben S. Bernanke
2006-06-12,Modern Risk Management and Banking Supervision,Chairman Ben S. Bernanke
2006-06-12,A Supervisor’s Perspective on Enterprise Risk Management,Governor Susan Schmidt Bies
2006-06-12,What Are Examiners Looking for When They Examine Banks for Compliance?,Governor Mark W. Olson
2006-06-13, Increasing Economic Opportunity: Challenges and Strategies,Chairman Ben S. Bernanke
2006-06-14,A Supervisor's Perspective on Mortgage Markets and Mortgage Lending Practices,Governor Susan Schmidt Bies
2006-06-15,Energy and the Economy,Chairman Ben S. Bernanke
2006-06-15,Why Are Yield Curves So Flat and Long Rates So Low Globally?,Governor Randall S. Kroszner
2006-06-16,Why Are Yield Curves So Flat and Long Rates So Low Globally?,Governor Randall S. Kroszner
2006-06-16,The Effects of Globalization on Inflation and Their Implications for Monetary Policy,Governor Donald L. Kohn
2006-07-04,Addressing Challenges Raised by Basel II Implementation,Governor Susan Schmidt Bies
2006-07-06,Reflections on Globalization and Policies,Vice Chairman Donald L. Kohn
2006-07-18,Corporate Cash Balances and Economic Activity,Governor Kevin Warsh
2006-08-25,Global Economic Integration: What's New and What's Not?,Chairman Ben S. Bernanke
2006-08-31,Productivity,Chairman Ben S. Bernanke
2006-09-01,Remarks,Chairman Ben S. Bernanke
2006-09-11,Evolution of Retail Payments and the Role of the Federal Reserve,Vice Chairman Donald L. Kohn
2006-09-27,What Drives Productivity Growth?  Implications for the Economy and Prospects for the Future,Governor Randall S. Kroszner
2006-10-04,Economic Outlook,Vice Chairman Donald L. Kohn
2006-10-04,The Coming Demographic Transition: Will We Treat Future Generations Fairly?,Chairman Ben S. Bernanke
2006-10-11,A U.S. Supervisor's Perspective on Current Banking Issues,Governor Susan Schmidt Bies
2006-10-12,Globalization: A Force for Good?,Governor Frederic S. Mishkin
2006-10-16,Bank Regulation and Supervision: Balancing Benefits and Costs,Chairman Ben S. Bernanke
2006-10-17,A Supervisory Perspective on Enterprise Risk Management,Governor Susan Schmidt Bies
2006-11-01,Community Development Financial Institutions: Promoting Economic Growth and Opportunity,Chairman Ben S. Bernanke
2006-11-02,The Economic Outlook,Governor Susan S. Bies
2006-11-03,The Evolving Role of the Federal Reserve Banks,Vice Chairman Donald L. Kohn
2006-11-10,Monetary Aggregates and Monetary Policy at the Federal Reserve: A Historical Perspective,Chairman Ben S. Bernanke
2006-11-16,The Conquest of Worldwide Inflation: Currency Competition and Its Implications for Interest Rates and the Yield Curve,Governor Randall S. Kroszner
2006-11-21,Financial Markets and the Federal Reserve,Governor Kevin Warsh
2006-11-28,The Economic Outlook,Chairman Ben S. Bernanke
2006-11-30,A U.S. Perspective on Basel II Implementation,Governor Susan Schmidt Bies
2006-12-01,Monetary Policy and Uncertainty,Vice Chairman Donald L. Kohn
2006-12-01,Welcoming remarks,Chairman Ben S. Bernanke
2006-12-15,The Chinese Economy: Progress and Challenges,Chairman Ben S. Bernanke
2007-01-05,Central Banking and Bank Supervision in the United States,Chairman Ben S. Bernanke
2007-01-08,The Economic Outlook ,Vice Chairman Donald L. Kohn
2007-01-11,Enterprise Risk Management and Mortgage Lending,Governor Susan Schmidt Bies
2007-01-17,Enterprise Risk Management and Mortgage Lending,Governor Frederic S. Mishkin
2007-01-18,Economic Outlook and Developments in Mortgage Markets ,Governor Susan Schmidt Bies
2007-02-06,The Level and Distribution of Economic Well-Being,Chairman Ben S. Bernanke
2007-02-21,Financial Stability: Preventing and Managing Crises,Vice Chairman Donald L. Kohn
2007-02-26,An Update on Basel II Implementation in the United States,Governor Susan Schmidt Bies
2007-03-02,Globalization and Monetary Policy,Chairman Ben S. Bernanke
2007-03-05,Market Liquidity: Definitions and Implications,Governor Kevin Warsh
2007-03-05,Community Banks: The Continuing Importance of Relationship Finance,Governor Randall S. Kroszner
2007-03-06,"GSE Portfolios, Systemic Risk, and Affordable Housing",Chairman Ben S. Bernanke
2007-03-09,"Comments on “Understanding the Evolving Inflation Process” by Cecchetti, Hooper, Kasman, Schoenholtz, and Watson",Vice Chairman Donald L. Kohn
2007-03-09,Liquidity and monetary policy,Governor Randall S. Kroszner
2007-03-12,The Changing Dynamics of Inflation,Governor Randall S. Kroszner
2007-03-22,"Asset-Pricing Puzzles, Credit Risk, and Credit Derivatives",Vice Chairman Donald L. Kohn
2007-03-22,Recent Innovations in Credit Markets,Governor Randall S. Kroszner
2007-03-23,Inflation Dynamics,Governor Frederic S. Mishkin
2007-03-30,The Community Reinvestment Act: Its Evolution and New Challenges,Chairman Ben S. Bernanke
2007-04-10,Monetary Policy and the Dual Mandate,Governor Frederic S. Mishkin
2007-04-11,Financial Regulation and the Invisible Hand,Chairman Ben S. Bernanke
2007-04-20,The U.S. Economic Outlook,Governor Frederic S. Mishkin
2007-04-25,Welcoming remarks,Chairman Ben S. Bernanke
2007-04-26,Globalization and Financial Development,Governor Frederic S. Mishkin
2007-05-01,Embracing the Challenge of Free Trade: Competing and Prospering in a Global Economy,Chairman Ben S. Bernanke
2007-05-10,The Future of Payments: Challenges and Opportunities,Governor Randall S. Kroszner
2007-05-15,International Capital Flows and the Emerging-Market Economies,Governor Randall S. Kroszner
2007-05-15,Regulation and Financial Innovation,Chairman Ben S. Bernanke
2007-05-16,Globalization and Capital Markets: Implications for Inflation and the Yield Curve,Governor Randall S. Kroszner
2007-05-16,Financial stability and policy issues,Vice Chairman Donald L. Kohn
2007-05-17,The Subprime Mortgage Market,Chairman Ben S. Bernanke
2007-05-22,Recognizing Leadership,Chairman Ben S. Bernanke
2007-05-23,Creating More Effective Consumer Disclosures,Governor Randall S. Kroszner
2007-05-24,Estimating Potential Output,Governor Frederic S. Mishkin
2007-06-01,Outlook and Risks for the U.S. Economy,Governor Randall S. Kroszner
2007-06-05,Financial Intermediation and Complete Markets ,Governor Kevin Warsh
2007-06-05,The Housing Market and Subprime Lending,Chairman Ben S. Bernanke
2007-06-14,Encouraging Responsible Mortgage Lending: Prospective Rulemaking Initiatives,Governor Randall S. Kroszner
2007-06-15,The Financial Accelerator and the Credit Channel,Chairman Ben S. Bernanke
2007-06-23,Globalization and Financial Development,Governor Frederic S. Mishkin
2007-07-10,Inflation Expectations and Inflation Forecasting,Chairman Ben S. Bernanke
2007-07-12,Basel II Implementation in the United States,Governor Randall S. Kroszner
2007-08-01,Federal Reserve Initiatives to Support Minority-Owned Institutions and Expand Consumer Protection,Governor Randall S. Kroszner
2007-08-31,"Housing, Housing Finance, and Monetary Policy",Chairman Ben S. Bernanke
2007-09-06,Analyzing and Assessing Banking Crises,Governor Randall S. Kroszner
2007-09-10,Outlook and Risks for the U.S. Economy,Governor Frederic S. Mishkin
2007-09-11,Global Imbalances:  Recent Developments and Prospects,Chairman Ben S. Bernanke
2007-09-21,Success and Failure of Monetary Policy since the 1950s,Vice Chairman Donald L. Kohn
2007-09-21,Financial Market Developments,Governor Kevin Warsh
2007-09-24,Education and Economic Competitiveness,Chairman Ben S. Bernanke
2007-09-27,"Globalization, Macroeconomic Performance, and Monetary Policy",Governor Frederic S. Mishkin
2007-09-28,Systemic Risk and the International Lender of Last Resort ,Governor Frederic S. Mishkin
2007-10-05,Financial Stability and the Federal Reserve,Governor Kevin Warsh
2007-10-05, Economic Outlook,Vice Chairman Donald L. Kohn
2007-10-11,"Markets, Financial Institutions, and Consumers: The Roles of the Federal Reserve",Governor Randall S. Kroszner
2007-10-12,Opening remarks,Chairman Ben S. Bernanke
2007-10-12,John Taylor Rules,Vice Chairman Donald L. Kohn
2007-10-15,The Recent Financial Turmoil and its Economic and Policy Consequences,Chairman Ben S. Bernanke
2007-10-19,Monetary Policy under Uncertainty,Chairman Ben S. Bernanke
2007-10-20,Headline versus Core Inflation in the Conduct of Monetary Policy,Governor Frederic S. Mishkin
2007-10-22,Recent Events in Financial Markets,Governor Randall S. Kroszner
2007-10-26,Financial Instability and the Federal Reserve as a Liquidity Provider,Governor Frederic S. Mishkin
2007-11-05,The Challenges Facing Subprime Mortgage Borrowers,Governor Randall S. Kroszner
2007-11-05,Financial Instability and Monetary Policy,Governor Frederic S. Mishkin
2007-11-06,Microfinance in the United States,Chairman Ben S. Bernanke
2007-11-07,The End of History?,Governor Kevin Warsh
2007-11-13,Implementing Basel II in the United States,Governor Randall S. Kroszner
2007-11-14,Federal Reserve Communications,Chairman Ben S. Bernanke
2007-11-16,Risk Management and the Economic Outlook,Governor Randall S. Kroszner
2007-11-28,Financial Markets and Central Banking,Vice Chairman Donald L. Kohn
2007-11-29,The Federal Reserve’s Enhanced Communication Strategy and the Science of Monetary Policy ,Governor Frederic S. Mishkin
2007-11-29,National and regional economic overview,Chairman Ben S. Bernanke
2007-11-30,"Innovation, Information, and Regulation in Financial Markets ",Governor Randall S. Kroszner
2008-01-04,"Expertise and Macroeconomic Policy, Comments on ""Insiders versus Outsiders in Monetary Policy-Making,"" by Timothy Besley, Neil Meads, and Paolo Surico",Vice Chairman Donald L. Kohn
2008-01-05,Recent and Prospective Developments in Monetary Policy Transparency and Communications:  A Global Perspective,Vice Chairman Donald L. Kohn
2008-01-10,"Financial Markets, the Economic Outlook, and Monetary Policy",Chairman Ben S. Bernanke
2008-01-11,"Monetary Policy Flexibility, Risk Management, and Financial Disruptions",Governor Frederic S. Mishkin
2008-02-04,Protecting Homeowners and Sustaining Home Ownership,Governor Randall S. Kroszner
2008-02-15,The Federal Reserve's Tools for Responding to Financial Disruptions,Governor Frederic S. Mishkin
2008-02-25,Does Stabilizing Inflation Contribute to Stabilizing Economic Activity?,Governor Frederic S. Mishkin
2008-02-25,Improving Risk Management in Light of Recent Market Events,Governor Randall S. Kroszner
2008-02-26,The U.S. Economy and Monetary Policy,Vice Chairman Donald L. Kohn
2008-02-27,The Importance of Economic Education and Financial Literacy,Governor Frederic S. Mishkin
2008-02-29,"On ""Leveraged Losses: Lessons from the Mortgage Meltdown""",Governor Frederic S. Mishkin
2008-03-03,Liquidity-Risk Management in the Business of Banking,Governor Randall S. Kroszner
2008-03-04,Outlook and Risks for the U.S. Economy,Governor Frederic S. Mishkin
2008-03-04,Reducing Preventable Mortgage Foreclosures,Chairman Ben S. Bernanke
2008-03-07,Exchange Rate Pass-Through and Monetary Policy,Governor Frederic S. Mishkin
2008-03-07,Implications of Globalization for the Conduct of Monetary Policy,Vice Chairman Donald L. Kohn
2008-03-11,The Importance of Fundamentals in Risk Management,Governor Randall S. Kroszner
2008-03-14,Fostering Sustainable Homeownership,Chairman Ben S. Bernanke
2008-03-27,"Comfort Zones, Shmumfort Zones",Governor Frederic S. Mishkin
2008-03-27,Protecting Homeowners and Sustaining Homeownership,Governor Randall S. Kroszner
2008-04-03,Central Bank Commitment and Communication,Governor Frederic S. Mishkin
2008-04-04,Global Economic and Financial Challenges: Implications for Latin America,Governor Randall S. Kroszner
2008-04-07,Dedication remarks,Vice Chairman Donald L. Kohn
2008-04-09,The Importance of Financial Education and the National Jump$tart Coalition Survey,Chairman Ben S. Bernanke
2008-04-10,Addressing Weaknesses in the Global Financial Markets: The Report of the President's Working Group on Financial Markets,Chairman Ben S. Bernanke
2008-04-14,Financial Market Turmoil and the Federal Reserve: The Plot Thickens,Governor Kevin Warsh
2008-04-17,The Changing Business of Banking: Implications for Financial Stability and Lessons from Recent Market Turmoil,Vice Chairman Donald L. Kohn
2008-04-21,Developing Sustainable Capital for Community Investments,Governor Randall S. Kroszner
2008-05-05,Mortgage Delinquencies and Foreclosures,Chairman Ben S. Bernanke
2008-05-07,Mitigating the Impact of Foreclosures on Neighborhoods,Governor Randall S. Kroszner
2008-05-13,Liquidity Provision by the Federal Reserve,Chairman Ben S. Bernanke
2008-05-14,Risk Management and Basel II,Governor Randall S. Kroszner
2008-05-15,How Should We Respond to Asset Price Bubbles? ,Governor Frederic S. Mishkin
2008-05-15,Risk Management in Financial Institutions,Chairman Ben S. Bernanke
2008-05-20,The Economic Outlook,Vice Chairman Donald L. Kohn
2008-05-21,The Federal Funds Rate in Extraordinary Times,Governor Kevin Warsh
2008-05-22,Prospects for Recovery and Repair of Mortgage Markets ,Governor Randall S. Kroszner
2008-05-29,Money Markets and Financial Stability,Vice Chairman Donald L. Kohn
2008-06-03,Remarks on the economic outlook,Chairman Ben S. Bernanke
2008-06-04,Remarks on Class Day 2008,Chairman Ben S. Bernanke
2008-06-06,Financial Market Developments and Credit Conditions,Governor Randall S. Kroszner
2008-06-09,Outstanding Issues in the Analysis of Inflation,Chairman Ben S. Bernanke
2008-06-11,Lessons for Central Bankers from a Phillips Curve Framework,Vice Chairman Donald L. Kohn
2008-06-11,Protecting Consumers in the Credit Marketplace,Governor Randall S. Kroszner
2008-06-12,Dedication of the New Federal Reserve Bank of Kansas City Building,Chairman Ben S. Bernanke
2008-06-16,Challenges for Health-Care Reform,Chairman Ben S. Bernanke
2008-06-26,Global Economic Integration and Decoupling,Vice Chairman Donald L. Kohn
2008-07-02,Global Financial Turmoil and the World Economy,Governor Frederic S. Mishkin
2008-07-08,Financial Regulation and Financial Stability,Chairman Ben S. Bernanke
2008-07-17,Federal Reserve's Initiatives to Support Minority-Owned Institutions and Expand Consumer Protection,Governor Randall S. Kroszner
2008-07-28,Remarks on covered bond framework,Governor Kevin Warsh
2008-07-28,Whither Federal Reserve Communications,Governor Frederic S. Mishkin
2008-08-22,Reducing Systemic Risk,Chairman Ben S. Bernanke
2008-09-01,The United States in the International Financial System:  A Separate Reality? Resolving Two Puzzles in the International Accounts,Governor Randall S. Kroszner
2008-09-09,Remarks on historically black colleges and universities,Chairman Ben S. Bernanke
2008-09-11,"Comments on “Financial Regulation in a System Context,” “Beyond Leveraged Losses: The Balance Sheet Effects of the Home Price Downturn,” and “The Central Role of House Prices in the Financial Crisis: How Will the Market Clear?”",Vice Chairman Donald L. Kohn
2008-10-07,Current Economic and Financial Conditions,Chairman Ben S. Bernanke
2008-10-14,Remarks,Chairman Ben S. Bernanke
2008-10-15,Stabilizing the Financial Markets and the Economy,Chairman Ben S. Bernanke
2008-10-15,Economic Outlook,Vice Chairman Donald L. Kohn
2008-10-20,Strategic Risk Management in an Interconnected World,Governor Randall S. Kroszner
2008-10-31,The Future of Mortgage Finance in the United States ,Chairman Ben S. Bernanke
2008-11-06,The Promise and Peril of the New Financial Architecture,Governor Kevin Warsh
2008-11-12,Productivity and Innovation in Financial Services ,Vice Chairman Donald L. Kohn
2008-11-14,Policy Coordination Among Central Banks ,Chairman Ben S. Bernanke
2008-11-19,Monetary Policy and Asset Prices Revisited,Vice Chairman Donald L. Kohn
2008-12-01,Federal Reserve Policies in the Financial Crisis,Chairman Ben S. Bernanke
2008-12-03,The Community Reinvestment Act and the Recent Mortgage Crisis,Governor Randall S. Kroszner
2008-12-04,"Housing, Mortgage Markets, and Foreclosures",Chairman Ben S. Bernanke
2008-12-04,Improving the Infrastructure for Non-Agency Mortgage-Backed Securities,Governor Randall S. Kroszner
2008-12-08,Restoring Financial Intermediation by Banks: The Role of Regulators,Vice Chairman Donald L. Kohn
2008-12-08,Assessing the Potential for Instability in Financial Markets,Governor Randall S. Kroszner
2009-01-13,The Crisis and the Policy Response,Chairman Ben S. Bernanke
2009-02-11,Stabilizing the Housing Market:  Next Steps,Governor Elizabeth A. Duke
2009-02-16,Stabilizing the Housing Market: Focus on Communities,Governor Elizabeth A. Duke
2009-02-18,Federal Reserve Policies to Ease Credit and Their Implications for the Fed's Balance Sheet,Chairman Ben S. Bernanke
2009-02-24,CRA: A Framework for the Future,Governor Elizabeth A. Duke
2009-03-07,Brief Remarks,Chairman Ben S. Bernanke
2009-03-10,Financial Reform to Address Systemic Risk,Chairman Ben S. Bernanke
2009-03-20,The Financial Crisis and Community Banking,Chairman Ben S. Bernanke
2009-03-30,A Framework for Analyzing Bank Lending,Governor Elizabeth A. Duke
2009-04-03,Policies to Bring Us Out of the Financial Crisis and Recession,Vice Chairman Donald L. Kohn
2009-04-03,The Federal Reserve's Balance Sheet ,Chairman Ben S. Bernanke
2009-04-06,The Panic of 2008,Governor Kevin Warsh
2009-04-14,Four Questions about the Financial Crisis,Chairman Ben S. Bernanke
2009-04-17,Financial Innovation and Consumer Protection,Chairman Ben S. Bernanke
2009-04-18,Monetary Policy in the Financial Crisis,Vice Chairman Donald L. Kohn
2009-04-20,The Economic Outlook,Vice Chairman Donald L. Kohn
2009-05-07,Lessons of the Financial Crisis for Banking Supervision,Chairman Ben S. Bernanke
2009-05-11,The Supervisory Capital Assessment Program,Chairman Ben S. Bernanke
2009-05-22,Commencement address,Chairman Ben S. Bernanke
2009-05-23,Interactions between Monetary and Fiscal Policy in the Current Situation,Vice Chairman Donald L. Kohn
2009-06-04,Welcoming Remarks,Chairman Ben S. Bernanke
2009-06-08,Financial Regulation in the Wake of the Crisis,Governor Daniel K. Tarullo
2009-06-10,The Systemic Importance of Consumer Protection,Governor Elizabeth A. Duke
2009-06-15,Large Banks and Small Banks in an Era of Systemic Risk Regulation,Governor Daniel K. Tarullo
2009-06-15,Containing the Crisis and Promoting Economic Recovery,Governor Elizabeth A. Duke
2009-06-16,Defining Deviancy,Governor Kevin Warsh
2009-06-17,Community Development Financial Institutions: Challenges and Opportunities,Chairman Ben S. Bernanke
2009-06-26,Brief Remarks,Chairman Ben S. Bernanke
2009-07-09,Federal Reserve's Initiatives to Support Minority-Owned Institutions ,Governor Elizabeth A. Duke
2009-07-10,"Comments on ""Financial Intermediation and the Post-Crisis Financial System""",Vice Chairman Donald L. Kohn
2009-08-21,Reflections on a Year of Crisis,Chairman Ben S. Bernanke
2009-08-21,Bagehot's Dictum in Practice: Formulating and Implementing Policies to Combat the Financial Crisis,"Brian F. Madigan, Director, Division of Monetary Affairs"
2009-08-25,The Community Affairs Function at the Federal Reserve,Governor Daniel K. Tarullo
2009-09-10,"Comments on ""Interpreting the Unconventional U.S. Monetary Policy of 2007-2009""",Vice Chairman Donald L. Kohn
2009-09-14,Regulatory Perspectives on the Changing Accounting Landscape,Governor Elizabeth A. Duke
2009-09-25,Brief Remarks,Chairman Ben S. Bernanke
2009-09-25,"Longer Days, Fewer Weekends",Governor Kevin Warsh
2009-09-30,Central Bank Exit Policies,Vice Chairman Donald L. Kohn
2009-10-08,In the Wake of the Crisis,Governor Daniel K. Tarullo
2009-10-08,The Federal Reserve's Balance Sheet: An Update,Chairman Ben S. Bernanke
2009-10-09,Monetary Policy Research and the Financial Crisis: Strengths and Shortcomings,Vice Chairman Donald L. Kohn
2009-10-13,The Economic Outlook,Vice Chairman Donald L. Kohn
2009-10-19,Asia and the Global Financial Crisis,Chairman Ben S. Bernanke
2009-10-21,Confronting Too Big to Fail,Governor Daniel K. Tarullo
2009-10-23,Financial Regulation and Supervision after the Crisis: The Role of the Federal Reserve,Chairman Ben S. Bernanke
2009-10-23,International Perspective on the Crisis and Response,Vice Chairman Donald L. Kohn
2009-11-02,"Incentive Compensation, Risk Management, and Safety and Soundness",Governor Daniel K. Tarullo
2009-11-09,Financial Regulation: Past and Future,Governor Daniel K. Tarullo
2009-11-10,Supervising and Resolving Large Financial Institutions,Governor Daniel K. Tarullo
2009-11-16,Policy Challenges for the Federal Reserve,Vice Chairman Donald L. Kohn
2009-11-16,On the Outlook for the Economy and Policy,Chairman Ben S. Bernanke
2009-12-07,Frequently Asked Questions,Chairman Ben S. Bernanke
2009-12-09,Keys to Successful Neighborhood Stabilization,Governor Elizabeth A. Duke
2009-12-10,Envisioning a Future for Housing Finance,Governor Elizabeth A. Duke
2010-01-03,Monetary Policy and the Housing Bubble,Chairman Ben S. Bernanke
2010-01-03,"Monetary Policy in the Crisis: Past, Present, and Future",Vice Chairman Donald L. Kohn
2010-01-04,The Economic Outlook,Governor Elizabeth A. Duke
2010-01-29,Focusing on Bank Interest Rate Risk Exposure,Vice Chairman Donald L. Kohn
2010-02-03,Regulation and Its Discontents,Governor Kevin Warsh
2010-02-03,Swearing-In Ceremony Remarks,Chairman Ben S. Bernanke
2010-02-18,Unusual and Exigent: My First Year at the Fed,Governor Elizabeth A. Duke
2010-02-26,Financial Regulatory Reform,Governor Daniel K. Tarullo
