release_date,title,speaker
2002-01-16,Developments in the U.S. economy: Review and outlook,"Vice Chairman Roger W. Ferguson, Jr."
2002-01-16,Rules and discretion,Governor Laurence H. Meyer
2002-01-16,The history of money,Chairman Alan Greenspan
2002-01-18,Predatory lending,Governor Edward M. Gramlich
2002-02-07,Observations on the evolution of the financial services industry and public policy,Governor Mark W. Olson
2002-02-08,Implementing the Gramm-Leach-Bliley Act: Two years later,Governor Mark W. Olson
2002-02-20,Consumption and the wealth effect: The United States and the United Kingdom,Governor Edward M. Gramlich
2002-02-27,A review of economic developments in 2001 and the economic outlook,"Vice Chairman Roger W. Ferguson, Jr."
2002-02-28,Saving for retirement,Chairman Alan Greenspan
2002-02-28,Strengthening the financial system of the 21st century through sound accounting and disclosure,Governor Susan Schmidt Bies
2002-03-01,Lending to lower-income households,Governor Edward M. Gramlich
2002-03-04,A supervisory perspective on disaster recovery and business continuity,"Vice Chairman Roger W. Ferguson, Jr."
2002-03-04,Back to the future in managing banking risk,"Vice Chairman Roger W. Ferguson, Jr."
2002-03-07,Macroeconomic policy in recessions--and other times,Governor Edward M. Gramlich
2002-03-12,Current industry issues,Governor Mark W. Olson
2002-03-13,The U.S. economy,Chairman Alan Greenspan
2002-03-21,Current challenges of community banks,Governor Susan S. Bies
2002-03-26,Career development in a changing economy,Governor Mark W. Olson
2002-03-26,Corporate governance,Chairman Alan Greenspan
2002-04-08,CRA at twenty-five,Governor Edward M. Gramlich
2002-04-22,Finance: United States and global,Chairman Alan Greenspan
2002-04-30,Risk management in a changing economic environment,Governor Mark W. Olson
2002-05-02,Financial literacy,Governor Edward M. Gramlich
2002-05-03,Stock options and related matters,Chairman Alan Greenspan
2002-05-09,Implications of 9/11 for the financial services sector,"Vice Chairman Roger W. Ferguson, Jr."
2002-05-10,Cyclicality and banking regulation,Chairman Alan Greenspan
2002-05-11,Thoughts on success in life,"Vice Chairman Roger W. Ferguson, Jr."
2002-05-13,Reflections on financial literacy,"Vice Chairman Roger W. Ferguson, Jr."
2002-05-17,Financing options for small business,Governor Mark W. Olson
2002-05-21,A look at the banking industry in 2002,Governor Mark W. Olson
2002-05-21,Community and regional banks: Increasing complexity and risk-management needs,"Vice Chairman Roger W. Ferguson, Jr."
2002-05-31,The dual banking system and the current condition of the banking industry,Governor Mark W. Olson
2002-06-10,Lessons to be re-learned from recent breakdowns in corporate accounting,Governor Susan S. Bies
2002-06-11,Bank performance and corporate governance,Governor Susan S. Bies
2002-06-20,Banking supervision and its application in developing countries,Governor Susan S. Bies
2002-07-05,Introductory remarks,Governor Edward M. Gramlich
2002-07-08,Financial markets regulation in the United States,Governor Mark W. Olson
2002-07-26,Economic change in rural America,Governor Mark W. Olson
2002-08-30,Economic volatility,Chairman Alan Greenspan
2002-09-25,Policy coordination,Chairman Alan Greenspan
2002-09-25,"Regulation, innovation, and wealth creation",Chairman Alan Greenspan
2002-09-25,World finance and risk management,Chairman Alan Greenspan
2002-09-28,Bank performance and corporate governance,Governor Susan S. Bies
2002-10-01,The challenge for corporate governance posed by financial innovation,Governor Susan S. Bies
2002-10-03,Business continuity after September 11,"Vice Chairman Roger W. Ferguson, Jr."
2002-10-07,Banking,Chairman Alan Greenspan
2002-10-08,Corporate governance and risk management,Governor Susan S. Bies
2002-10-09,Central banks and markets,"Vice Chairman Roger W. Ferguson, Jr."
2002-10-15,"Asset-price ""bubbles"" and monetary policy",Governor Ben S. Bernanke
2002-10-16,Should financial stability be an explicit central bank objective?,"Vice Chairman Roger W. Ferguson, Jr"
2002-10-16,Remarks,"Vice Chairman Roger W. Ferguson, Jr"
2002-10-16,The methodology of benefit-cost analysis,Governor Edward M. Gramlich
2002-10-22,Urban revitalization: Shared responsibilities,Governor Mark W. Olson
2002-10-23,Productivity,Chairman Alan Greenspan
2002-10-24,Productivity growth: A realistic assessment,"Vice Chairman Roger W. Ferguson, Jr."
2002-10-29,Education,Chairman Alan Greenspan
2002-11-07,Opening remarks,Governor Edward M. Gramlich
2002-11-07,Effective accounting and disclosure for financial transactions and financial institutions,Governor Susan S. Bies
2002-11-08,On Milton Friedman's ninetieth birthday,Governor Ben S. Bernanke
2002-11-12,The wealth of nations revisited,Chairman Alan Greenspan
2002-11-12,Recent experience and economic outlook,"Vice Chairman Roger W. Ferguson, Jr."
2002-11-12,Economic progress and small business,"Vice Chairman Roger W. Ferguson, Jr."
2002-11-12,The banking industry in 2002 after a decade of change,Governor Mark W. Olson
2002-11-12,Opening remarks,Governor Susan S. Bies
2002-11-18,Overcoming challenges and seizing opportunities in Indian Country,Governor Mark W. Olson
2002-11-18,Opening remarks,Chairman Alan Greenspan
2002-11-19,International financial risk management,Chairman Alan Greenspan
2002-11-20,Financial engineering and financial stability,"Vice Chairman Roger W. Ferguson, Jr."
2002-11-21,"Deflation: Making sure ""it"" doesn't happen here",Governor Ben S. Bernanke
2002-11-22,The U.S. current account deficit,Governor Donald L. Kohn
2002-12-13,Credit availability for small business,Governor Susan S. Bies
2002-12-13,The importance of market structure,Governor Mark W. Olson
2002-12-19,Issues for monetary policy,Chairman Alan Greenspan
2003-01-04,Conducting monetary policy,Governor Edward M. Gramlich
2003-02-03,"""Constrained discretion"" and monetary policy",Governor Ben S. Bernanke
2003-02-05,"September 11, the Federal Reserve, and the financial system","Vice Chairman Roger W. Ferguson, Jr."
2003-02-06,Gramm-Leach-Bliley Act and corporate misbehavior--coincidence or contributor?,Governor Mark W. Olson
2003-02-11,Financial markets and corporate governance in the United States and other countries,Governor Susan Schmidt Bies
2003-02-12,Rules and flexibility in monetary policy,"Vice Chairman Roger W. Ferguson, Jr"
2003-02-21,Balance sheets and the recovery,Governor Ben S. Bernanke
2003-02-27,"Retirement savings, equity ownership, and challenges to investors",Governor Susan Schmidt Bies
2003-02-28,The strength in consumer durables and housing: policy stabilization or problem in the making?,Governor Donald L. Kohn
2003-03-04,Home mortgage market,Chairman Alan Greenspan
2003-03-07,Global finance: Is it slowing?,Chairman Alan Greenspan
2003-03-13,Community bank performance in the twenty-first century,Governor Mark W. Olson
2003-03-24,"Comments on Marvin Goodfriend's ""Inflation Targeting in the United States?""",Governor Donald L. Kohn
2003-03-25,A perspective on inflation targeting,Governor Ben S. Bernanke
2003-03-28,Community economic development,Chairman Alan Greenspan
2003-04-03,Financial education,Chairman Alan Greenspan
2003-04-04,Market economies and rule of law,Chairman Alan Greenspan
2003-04-07,Patent policy in a broader context,"Vice Chairman Roger W. Ferguson, Jr."
2003-04-09,The Reagan legacy,Chairman Alan Greenspan
2003-04-09,Basel II: A realist's perspective,"Vice Chairman Roger W. Ferguson, Jr."
2003-04-10,Basel II: Its implications for second-tier and community-size banks,Governor Mark W. Olson
2003-04-24,Loan guarantee programs,Governor Edward M. Gramlich
2003-04-24,Will business investment bounce back?,Governor Ben S. Bernanke
2003-04-28,Basel II: A case study in risk management,"Vice Chairman Roger W. Ferguson, Jr."
2003-05-07,Corporate governance,Governor Susan Schmidt Bies
2003-05-08,Corporate governance,Chairman Alan Greenspan
2003-05-13,Unveiling of the redesigned U.S. $20 note,Chairman Alan Greenspan
2003-05-16,Commencement address,"Vice Chairman Roger W. Ferguson, Jr."
2003-05-22,Assessing prospects for economic growth in the United States,Governor Mark W. Olson
2003-05-30,Restoring our confidence in bank controls and financial statements,Governor Susan Schmidt Bies
2003-05-31,Some Thoughts on Monetary Policy in Japan,Governor Ben S. Bernanke
2003-06-10,Comment on Good Policies for Bad Governments: Behavioral Political Economy by Daniel J. Benjamin and David I. Laibson,Governor Donald L. Kohn
2003-06-10,Basel II: Scope of application in the United States,"Vice Chairman Roger W. Ferguson, Jr."
2003-06-11,Strengthening compliance through effective corporate governance,Governor Susan Schmidt Bies
2003-06-11,Uncertain times: Economic challenges facing the United States and Japan,"Vice Chairman Roger W. Ferguson, Jr."
2003-06-11,"Soft hearts, hard data: The use of quantitative analysis in community development",Governor Ben S. Bernanke
2003-06-13,Community economic development,Governor Edward M. Gramlich
2003-06-16,Managing business risks,Governor Susan Schmidt Bies
2003-06-17,Basel II: Some issues for implementation,"Vice Chairman Roger W. Ferguson, Jr."
2003-06-20,Central bank talk: Does it matter and why?,"Governor Donald L. Kohn and Brian P. Sack, Senior Economist"
2003-06-26,Bank management challenges in a low-interest-rate environment,Governor Mark W. Olson
2003-07-23,An unwelcome fall in inflation?,Governor Ben S. Bernanke
2003-08-07,The role of community bank directors in strengthening corporate governance,Governor Susan Schmidt Bies
2003-08-10,Effective corporate governance and the role of counsel,Governor Susan Schmidt Bies
2003-08-18,Remarks,Governor Edward M. Gramlich
2003-08-29,Monetary policy under uncertainty,Chairman Alan Greenspan
2003-09-04,Economic and financial education,Governor Edward M. Gramlich
2003-09-04,The economic outlook,Governor Ben S. Bernanke
2003-09-22,Increased availability of financial products and the need for improved financial literacy,Governor Mark W. Olson
2003-09-24,Productivity and monetary policy,Governor Donald L. Kohn
2003-09-26,Financial education,Chairman Alan Greenspan
2003-10-01,Maintaining price stability,Governor Edward M. Gramlich
2003-10-02,Monetary policy and the stock market: Some empirical results,Governor Ben S. Bernanke
2003-10-08,Comments on the current state of the economy,Governor Susan Schmidt Bies
2003-10-08,The future of financial services--Revisited,"Vice Chairman Roger W. Ferguson, Jr."
2003-10-08,Remarks,"Vice Chairman Roger W. Ferguson, Jr."
2003-10-09,An update on the predatory lending issue,Governor Edward M. Gramlich
2003-10-17,Panel discussion,Governor Ben S. Bernanke
2003-10-17,Panel discussion,Governor Donald L. Kohn
2003-10-24,Remarks,Governor Ben S. Bernanke
2003-10-29,Remarks,Chairman Alan Greenspan
2003-10-31,"Effective Market Discipline: The Roles of Auditors, Companies, and Analysts",Governor Susan Schmidt Bies
2003-11-06,Remarks,Chairman Alan Greenspan
2003-11-06,The jobless recovery,Governor Ben S. Bernanke
2003-11-13,The Proposed U.S. Approach to Regulatory Capital: An Update,"Vice Chairman Roger W. Ferguson, Jr."
2003-11-14,Remarks on preserving and improving affordable rental housing,Governor Edward M. Gramlich
2003-11-20,Current Account,Chairman Alan Greenspan
2003-11-21,Economic Outlook,"Vice Chairman Roger W. Ferguson, Jr."
2003-11-22,Functional Regulation and Financial Modernization,Governor Mark W. Olson
2003-12-02,Concerns and Considerations for the Practical Implementation of the New Basel Accord,"Vice Chairman Roger W. Ferguson, Jr."
2003-12-11,Capitalism and the role of globalization,Chairman Alan Greenspan
2004-01-03,Risk and Uncertainty in Monetary Policy,Chairman Alan Greenspan
2004-01-03,Fedspeak,Governor Ben S. Bernanke
2004-01-03,Conducting Monetary Policy at Very Low Short-Term Interest Rates,"Governor Ben S. Bernanke and Vincent R. Reinhart, Director, Division of Monetary Affairs"
2004-01-04,Monetary Policy and the Economic Outlook: 2004,Governor Ben S. Bernanke
2004-01-04,Lessons from Past Productivity Booms,"Vice Chairman Roger W. Ferguson, Jr."
2004-01-07,The United States in the World Economy,Governor Donald L. Kohn
2004-01-13,Globalization,Chairman Alan Greenspan
2004-01-14,Conducting Monetary Policy at Very Low Short-Term Interest Rates,Governor Ben S. Bernanke
2004-01-26,Economic flexibility,Chairman Alan Greenspan
2004-02-04,Enterprise-wide Compliance Programs,Governor Susan Schmidt Bies
2004-02-19,Financial Markets and Corporate Governance,Governor Susan Schmidt Bies
2004-02-20,The Great Moderation,Governor Ben S. Bernanke
2004-02-20,The critical role of education in the nation's economy,Chairman Alan Greenspan
2004-02-23,Understanding household debt obligations,Chairman Alan Greenspan
2004-02-25,"Budget and Trade Deficits: Linked, Both Worrisome in the Long Run, but not Twins",Governor Edward M. Gramlich
2004-02-25,Qualitative Aspects of Effective Risk Management,Governor Susan Schmidt Bies
2004-02-26,The Economic Outlook and the State of Household and Business Finances,Governor Susan Schmidt Bies
2004-02-26,Euro at Five: Ready for a Global Role?,Governor Ben S. Bernanke
2004-02-27,A Regulator's View of Emerging Issues in Community Banking,Governor Mark W. Olson
2004-02-27,Intellectual property rights,Chairman Alan Greenspan
2004-03-01,U.S. Banking Industry Performance Highlights--2003,Governor Mark W. Olson
2004-03-02,Current account,Chairman Alan Greenspan
2004-03-02,"Money, Gold, and the Great Depression",Governor Ben S. Bernanke
2004-03-12,Education,Chairman Alan Greenspan
2004-03-17,Banking,Chairman Alan Greenspan
2004-03-25,Rural economic issues,Chairman Alan Greenspan
2004-03-25,Monetary Policy in a Time of Macroeconomic Transition,Governor Donald L. Kohn
2004-03-26,The Board's Modeling Work in the 1960s,Governor Edward M. Gramlich
2004-03-26,"Research at the Federal Reserve Board: The Contributions of Henderson, Porter, and Tinsley",Governor Donald L. Kohn
2004-03-27,Monetary Policy Modeling: Where Are We and Where Should We Be Going?,Governor Ben S. Bernanke
2004-03-30,Trade and Jobs,Governor Ben S. Bernanke
2004-03-31,"Budget and Trade Deficits: Linked, Both Worrisome in the Long Run, but not Twins",Governor Edward M. Gramlich
2004-04-01,Financial education and Jump$tart survey,Governor Ben S. Bernanke
2004-04-01,Monetary Policy and Imbalances,Governor Donald L. Kohn
2004-04-08,Macroeconomic Outlook and Uncertainties,"Vice Chairman Roger W. Ferguson, Jr."
2004-04-15,What Policymakers Can Learn from Asset Prices,Governor Ben S. Bernanke
2004-04-16,Financial Access for Immigrants: The Case of Remittances,Governor Ben S. Bernanke
2004-04-16,Capitalizing reputation,Chairman Alan Greenspan
2004-04-22,The Economic Outlook and Financial Health of Bank Customers,Governor Susan Schmidt Bies
2004-04-22,The economic outlook and monetary policy,Governor Ben S. Bernanke
2004-04-23,Global Imbalances,"Vice Chairman Roger W. Ferguson, Jr."
2004-04-23,The economic outlook and monetary policy,Governor Ben S. Bernanke
2004-04-26,Preview of the Redesigned Series 2004 U.S. $50 Note,Governor Mark W. Olson
2004-04-26,Current Issues in Corporate Governance,Governor Susan Schmidt Bies
2004-04-27,Energy,Chairman Alan Greenspan
2004-04-27,Innovation in Financial Markets and Banking Relationships,Governor Susan Schmidt Bies
2004-05-05,The Federal Open Market Committee and the Formation of Monetary Policy,Governor Mark W. Olson
2004-05-06,Financial Innovation and Effective Risk Management,Governor Susan Schmidt Bies
2004-05-06,Globalization and innovation,Chairman Alan Greenspan
2004-05-06,Panel discussion: The Competitive Edge of Community Banks,Governor Mark W. Olson
2004-05-13,Financial literacy,Chairman Alan Greenspan
2004-05-14,"Budget and Trade Deficits: Linked, Both Worrisome in the Long Run, but not Twins",Governor Edward M. Gramlich
2004-05-17,The Role of Central Banks in Fostering Efficiency and Stability in the Global Financial System,"Vice Chairman Roger W. Ferguson, Jr."
2004-05-17,Corporate Governance and Community Banks,Governor Susan Schmidt Bies
2004-05-19,Corporate Governance: Where Do We Go From Here?,Governor Susan Schmidt Bies
2004-05-20,Workplace Financial Education,Governor Edward M. Gramlich
2004-05-20,Gradualism,Governor Ben S. Bernanke
2004-05-20,Acceptance of the Eisenhower Medal for Leadership and Service,Chairman Alan Greenspan
2004-05-21,"Subprime Mortgage Lending: Benefits, Costs, and Challenges",Governor Edward M. Gramlich
2004-05-22,Economics and Ethical Behaviors,"Vice Chairman Roger W. Ferguson, Jr."
2004-06-03,IASB reform,Governor Susan Schmidt Bies
2004-06-04,The Outlook for Inflation,Governor Donald L. Kohn
2004-06-08,Central Bank panel discussion: economic developments,Chairman Alan Greenspan
2004-06-10,"Regulatory Update: Banking Industry, Insurance, and Securities Activities",Governor Mark W. Olson
2004-06-15,Economic Outlook,Governor Mark W. Olson
2004-06-21,Euro at Five: Ready for a Global Role?,Governor Ben S. Bernanke
2004-06-22,Trends in Risk Management and Corporate Governance,Governor Susan Schmidt Bies
2004-06-24,Reducing Budget Deficits,Governor Edward M. Gramlich
2004-07-07,"Productivity: Past, Present, and Future","Vice Chairman Roger W. Ferguson, Jr."
2004-07-15,Business Financial Conditions and Relationships with Bankers,Governor Susan Schmidt Bies
2004-07-16,Using Enterprise-Wide Risk Management to Effectively Execute Business Strategies,Governor Susan Schmidt Bies
2004-07-21,"A Retrospective on Business-Cycle Recoveries: Are ""Jobless"" Recoveries the New Norm?","Vice Chairman Roger W. Ferguson, Jr."
2004-08-12,Rules for Assessing Social Security Reform,Governor Edward M. Gramlich
2004-08-12,Corporate Governance and Risk Management at Community Banks,Governor Susan Schmidt Bies
2004-08-27,Opening remarks,Chairman Alan Greenspan
2004-09-10,Introductory remarks,Governor Edward M. Gramlich
2004-09-16,Oil Shocks and Monetary Policy,Governor Edward M. Gramlich
2004-09-28,Challenges Facing the Accounting Profession Today,Governor Susan Schmidt Bies
2004-09-30,Developments in Financial Markets and Financial Management,Governor Susan Schmidt Bies
2004-10-04,The Implementation of Basel II: Some Issues for Cross-Border Banking,Governor Ben S. Bernanke
2004-10-05,Banking,Chairman Alan Greenspan
2004-10-06,Questions and Reflections on the Personal Saving Rate,"Vice Chairman Roger W. Ferguson, Jr."
2004-10-07,Free Trade: What Do Economists Really Know?,"Vice Chairman Roger W. Ferguson, Jr."
2004-10-07,Central Bank Talk and Monetary Policy,Governor Ben S. Bernanke
2004-10-07,Monetary policy twenty-five years after October 1979,Chairman Alan Greenspan
2004-10-08,Panel discussion: What Have We Learned Since October 1979?,Governor Ben S. Bernanke
2004-10-08,Panel discussion: Safeguarding Good Policy Practice through Maintaining Flexibility,"Vice Chairman Roger W. Ferguson, Jr."
2004-10-14,International Monetary Reform and Capital Freedom,Governor Ben S. Bernanke
2004-10-15,Oil,Chairman Alan Greenspan
2004-10-15,"How Should Policymakers Deal with Low-Probability, High-Impact Events?",Governor Donald L. Kohn
2004-10-19,The mortgage market and consumer debt,Chairman Alan Greenspan
2004-10-21,Oil and the Economy,Governor Ben S. Bernanke
2004-10-21,Enterprise Perspectives in Financial Institution Supervision,Governor Susan Schmidt Bies
2004-10-23,The Federal Reserve System and the Economy,Governor Susan Schmidt Bies
2004-10-26,Factors Influencing Business Investment,"Vice Chairman Roger W. Ferguson, Jr."
2004-10-29,Equilibrium Real Interest Rate: Theory and Application,"Vice Chairman Roger W. Ferguson, Jr."
2004-11-05,Financial Supervision Issues,Governor Susan Schmidt Bies
2004-11-15,Recent Economic Experience and Outlook,Governor Mark W. Olson
2004-11-18,Fair Value Accounting,Governor Susan Schmidt Bies
2004-11-19,Panel discussion: Euro in Wider Circles,Chairman Alan Greenspan
2004-12-02,The Logic of Monetary Policy,Governor Ben S. Bernanke
2004-12-07,Its Not Just about the Models: Recognizing the Importance of Qualitative Factors in an Effective Risk-Management Process,Governor Susan Schmidt Bies
2005-01-06,"Crisis Management: The Known, the Unknown, and the Unknowable",Governor Donald L. Kohn
2005-01-07,Panel Discussion: The Transition from Academic to Policymaker,Governor Ben S. Bernanke
2005-01-07,Interpreting Labor Market Statistics in the Context of Monetary Policy,"Vice Chairman Roger W. Ferguson, Jr."
2005-01-09,Central Bank Communication,Governor Donald L. Kohn
2005-01-12,Recessions and Recoveries Associated with Asset-Price Movements: What Do We Know?,"Vice Chairman Roger W. Ferguson, Jr."
2005-01-18,The Economy and Challenges in Retirement Savings,Governor Susan Schmidt Bies
2005-01-19,Productivity,Governor Ben S. Bernanke
2005-01-27,Recessions and Recoveries Associated with Asset-Price Movements: What Do We Know?,"Vice Chairman Roger W. Ferguson, Jr."
2005-02-04,Current account,Chairman Alan Greenspan
2005-02-06,Adam Smith,Chairman Alan Greenspan
2005-02-07,Behind the Scenes at the FOMC: How the Federal Reserve Determines Monetary Policy,Governor Susan Schmidt Bies
2005-02-11,Inflation in Latin America: A New Era?,Governor Ben S. Bernanke
2005-02-24,Productivity,Governor Ben S. Bernanke
2005-02-28,Loan Quality and How It Reflects the Overall Economy,Governor Mark W. Olson
2005-03-02,The Importance of Raising National Saving,Governor Edward M. Gramlich
2005-03-08,The Economic Outlook,Governor Ben S. Bernanke
2005-03-10,Globalization,Chairman Alan Greenspan
2005-03-10,The Global Saving Glut and the U.S. Current Account Deficit,Governor Ben S. Bernanke
2005-03-11,Bank regulation,Chairman Alan Greenspan
2005-03-14,Bank Secrecy Act and Capital Compliance Issues,Governor Susan Schmidt Bies
2005-03-18,"Empowering Communities, Attracting Development Capital, and Creating Opportunities",Chairman Alan Greenspan
2005-03-30,Implementing Monetary Policy,Governor Ben S. Bernanke
2005-03-31,"Home Mortgage Disclosure Act, Bank Secrecy Act, and Capital Issues",Governor Susan Schmidt Bies
2005-04-05,Energy,Chairman Alan Greenspan
2005-04-08,Consumer Finance,Chairman Alan Greenspan
2005-04-14,The Global Saving Glut and the U.S. Current Account Deficit,Governor Ben S. Bernanke
2005-04-14,Economic Outlook,Governor Donald L. Kohn
2005-04-18,The Economy and Managing Personal Finances,Governor Susan Schmidt Bies
2005-04-20,U.S. Current Account Deficit: Causes and Consequences,"Vice Chairman Roger W. Ferguson, Jr."
2005-04-21,A First Step in Dealing with Growing Retirement Costs,Governor Edward M. Gramlich
2005-04-22,Imbalances in the U.S. Economy,Governor Donald L. Kohn
2005-04-27,The Evolution of Central Banking in the United States,"Vice Chairman Roger W. Ferguson, Jr."
2005-05-05,Risk Transfer and Financial Stability,Chairman Alan Greenspan
2005-05-12,Globalization: Evidence and Policy Implications,"Vice Chairman Roger W. Ferguson, Jr."
2005-05-15,Commencement address,Chairman Alan Greenspan
2005-05-16,Basel II,Governor Mark W. Olson
2005-05-17,Financial Stability Benefits and Implementation Challenges of Basel II,Governor Susan Schmidt Bies
2005-05-19,Government-sponsored enterprises,Chairman Alan Greenspan
2005-05-19,Observations on Measuring and Managing Operational Risk under Basel II,Governor Susan Schmidt Bies
2005-05-19,The Federal Reserve in an Electronic World,Governor Mark W. Olson
2005-05-20,Modeling Inflation: A Policymakers Perspective,Governor Donald L. Kohn
2005-05-20,Energy,Chairman Alan Greenspan
2005-05-26,The Politics of Inflation Targeting,Governor Edward M. Gramlich
2005-05-26,Capital and Risk Management,Governor Susan Schmidt Bies
2005-05-27,Asset Prices and Monetary Liquidity,"Vice Chairman Roger W. Ferguson, Jr."
2005-06-03,HMDA Data and Their Effect on Mortgage Markets,Governor Edward M. Gramlich
2005-06-03,The Health of the Banking Industry,Governor Mark W. Olson
2005-06-06,Central Bank panel discussion,Chairman Alan Greenspan
2005-06-07,Community Banks: A Regulatory Update,Governor Susan Schmidt Bies
2005-06-08,Enhancing Risk Management under Basel II,Governor Susan Schmidt Bies
2005-06-14,Current Regulatory Issues,Governor Susan Schmidt Bies
2005-06-15,Managing Risk in a Changing Economic and Financial Landscape,Governor Donald L. Kohn
2005-06-23,Revisiting Traditional Paths to Ownership,Governor Mark W. Olson
2005-07-21,Monetary Policy Perspectives on Risk Premiums in Financial Markets,Governor Donald L. Kohn
2005-08-26,Reflections on central banking,Chairman Alan Greenspan
2005-08-27,"Panel discussion: Financial Markets, Financial Fragility, and Central Banking",Governor Donald L. Kohn
2005-08-27,Closing remarks,Chairman Alan Greenspan
2005-09-16,Business Trends and Management Challenges for the Banking Industry,Governor Mark W. Olson
2005-09-24,The Financial Stability Forum meeting,Vice Chairman Roger W. Ferguson
2005-09-26,Basel II Developments in the United States,Governor Susan Schmidt Bies
2005-09-26,Mortgage banking,Chairman Alan Greenspan
2005-09-27,Economic flexibility,Chairman Alan Greenspan
2005-09-28,U.S. currency,"Vice Chairman Roger W. Ferguson, Jr."
2005-09-29,Inflation Modeling: A Policymakers Perspective,Governor Donald L. Kohn
2005-10-11,"Globalization, Inflation, and Monetary Policy",Governor Donald L. Kohn
2005-10-12,Economic flexibility,Chairman Alan Greenspan
2005-10-12,Regulatory Issues,Governor Susan Schmidt Bies
2005-10-12,Update on the U.S. Economy and Fiscal Outlook,Governor Mark W. Olson
2005-10-13,Update on the U.S. Economy and Fiscal Outlook,Governor Mark W. Olson
2005-10-17,Energy,Chairman Alan Greenspan
2005-10-18,Economic Outlook for the United States,"Vice Chairman Roger W. Ferguson, Jr."
2005-10-19,The Economic Outlook,Governor Donald L. Kohn
2005-10-26,Remarks on receipt of the Truman Medal for Economic Policy,Chairman Alan Greenspan
2005-10-27,Opening remarks,Chairman Alan Greenspan
